ticket_id,user_id,created_at,resolved_at,status,category,feedback
1,4645,2023-11-01 17:01:53.949448,2023-11-06 17:01:53.949448,closed,billing,Thing write man wind.
2,6630,2024-04-19 13:48:41.750272,2024-04-28 13:48:41.750272,closed,technical,Right bag issue.
3,9594,2023-11-07 08:26:24.933452,2023-11-11 08:26:24.933452,closed,billing,Matter color charge head local.
4,7416,2024-07-20 21:43:12.897162,2024-07-22 21:43:12.897162,open,technical,Film walk help suffer.
5,9251,2024-07-10 21:01:29.738762,2024-07-13 21:01:29.738762,closed,billing,Bad for bill staff interesting course garden religious.
6,750,2023-11-24 06:29:25.002600,2023-11-27 06:29:25.002600,closed,technical,Cover where second late.
7,9590,2024-04-01 13:16:28.135976,2024-04-03 13:16:28.135976,closed,technical,Health study fine bank rise picture.
8,178,2025-01-23 20:34:04.426265,2025-02-01 20:34:04.426265,closed,billing,Important peace threat late single old.
9,3917,2024-01-14 15:11:00.582115,2024-01-19 15:11:00.582115,open,billing,Evening represent team full leg discover.
10,6674,2024-03-12 21:49:49.003854,2024-03-21 21:49:49.003854,open,technical,Who strategy their between try local church medical.
11,8985,2024-10-06 18:10:45.949715,2024-10-09 18:10:45.949715,open,technical,At claim pull smile college statement role beyond.
12,4469,2025-01-27 21:11:07.958082,2025-01-30 21:11:07.958082,closed,billing,Just up truth.
13,8720,2024-07-25 11:52:21.016059,2024-08-03 11:52:21.016059,closed,billing,Sister record according laugh.
14,2168,2024-09-24 22:19:13.810884,2024-09-30 22:19:13.810884,open,billing,Think bill teacher analysis truth.
15,5147,2023-11-15 00:27:16.017884,2023-11-20 00:27:16.017884,closed,technical,Recognize anyone second great these.
16,8853,2024-03-11 16:48:21.927446,2024-03-17 16:48:21.927446,open,billing,Size among truth explain word tell.
17,4164,2024-01-23 22:07:10.472751,2024-02-01 22:07:10.472751,open,billing,Hotel month health military national our game call.
18,8652,2024-12-13 07:23:27.821739,2024-12-17 07:23:27.821739,open,technical,Take attorney suffer item traditional memory political.
19,2001,2024-04-13 18:37:56.535806,2024-04-15 18:37:56.535806,open,technical,Huge affect laugh during.
20,1189,2024-10-03 05:02:13.602529,2024-10-11 05:02:13.602529,closed,technical,Will some sign after military.
21,5374,2023-12-15 17:46:29.434390,2023-12-18 17:46:29.434390,open,technical,Four list dinner foreign avoid water.
22,7394,2025-04-25 09:32:34.974438,2025-05-03 09:32:34.974438,open,billing,Task never every create letter dark.
23,3053,2025-05-20 02:36:30.641732,2025-05-22 02:36:30.641732,open,technical,Model score street direction.
24,8313,2024-02-06 16:56:11.231764,2024-02-09 16:56:11.231764,open,billing,Of pay option son start down involve response.
25,363,2023-08-12 23:53:09.848705,2023-08-15 23:53:09.848705,open,technical,National wear somebody reach adult.
26,9793,2023-07-18 06:29:35.177107,2023-07-21 06:29:35.177107,open,billing,From successful her big become total look body.
27,4649,2023-07-10 20:49:15.672641,2023-07-20 20:49:15.672641,closed,billing,Identify leave paper color accept tough gun.
28,7007,2024-06-25 09:56:01.293836,2024-06-29 09:56:01.293836,closed,billing,Finally read pay build job medical.
29,3458,2023-10-06 01:26:23.298549,2023-10-10 01:26:23.298549,closed,technical,Surface financial bill middle foot benefit create worry.
30,9091,2023-07-04 21:10:23.155949,2023-07-11 21:10:23.155949,closed,technical,White home physical.
31,2987,2024-08-30 04:18:41.811355,2024-09-08 04:18:41.811355,open,billing,Believe late speech.
32,541,2023-10-11 23:45:37.286562,2023-10-19 23:45:37.286562,closed,technical,Begin although eight enough visit.
33,8425,2025-04-20 07:11:31.140531,2025-04-23 07:11:31.140531,open,technical,Along why pretty quality man.
34,86,2025-06-03 12:01:43.941317,2025-06-13 12:01:43.941317,open,billing,Occur look admit step pass.
35,8435,2023-08-08 06:24:51.318735,2023-08-09 06:24:51.318735,open,technical,Nearly trip take participant paper.
36,622,2025-02-14 05:26:45.123710,2025-02-21 05:26:45.123710,open,billing,Traditional wind hand interview off board of.
37,727,2023-09-28 07:17:29.803277,2023-10-08 07:17:29.803277,closed,technical,True perform six.
38,3396,2025-02-21 05:01:28.118841,2025-02-26 05:01:28.118841,closed,technical,Society water yeah amount anything easy.
39,8970,2024-12-01 18:42:56.107832,2024-12-02 18:42:56.107832,open,billing,Attention stock despite early.
40,1551,2025-06-30 09:11:46.143281,2025-07-02 09:11:46.143281,closed,technical,True small marriage police what.
41,7595,2024-11-23 12:26:15.374425,2024-12-02 12:26:15.374425,closed,technical,Nice idea test land stand onto.
42,9060,2025-03-10 08:30:16.476900,2025-03-11 08:30:16.476900,closed,technical,Water everybody choose on claim himself.
43,7423,2023-10-01 21:46:30.428059,2023-10-08 21:46:30.428059,open,billing,Statement speak commercial age.
44,1939,2024-04-03 05:36:16.774121,2024-04-13 05:36:16.774121,open,technical,Film bag nearly language.
45,1258,2025-05-14 10:09:38.561876,2025-05-22 10:09:38.561876,closed,technical,Could see tend issue own training.
46,8484,2024-08-19 04:01:11.402017,2024-08-21 04:01:11.402017,closed,billing,Necessary image school hospital common long consumer blue.
47,9945,2024-11-17 18:22:43.350040,2024-11-27 18:22:43.350040,open,billing,Rest beat pick security subject business outside notice.
48,412,2023-08-04 11:20:01.009319,2023-08-06 11:20:01.009319,closed,technical,Stuff help moment let southern sport best.
49,3833,2025-04-23 18:12:38.864514,2025-05-02 18:12:38.864514,open,billing,Pm hospital after response nature.
50,3685,2024-01-21 16:56:59.238249,2024-01-24 16:56:59.238249,closed,billing,Doctor receive black provide leave that statement standard.
51,5865,2025-03-19 21:03:31.981260,2025-03-21 21:03:31.981260,open,technical,Thousand fast student.
52,2070,2025-05-28 14:48:32.708941,2025-06-06 14:48:32.708941,open,billing,Good stock nature early power.
53,4988,2024-02-24 10:18:59.573674,2024-02-27 10:18:59.573674,closed,billing,Pass budget serve policy according look analysis.
54,514,2025-01-13 12:10:10.799185,2025-01-22 12:10:10.799185,closed,technical,About staff discussion both eight your race.
55,683,2024-06-11 05:37:20.507255,2024-06-20 05:37:20.507255,open,technical,Hair project field decide happy stock week this.
56,3539,2024-04-14 02:08:33.275705,2024-04-19 02:08:33.275705,closed,billing,Game hundred rate.
57,8103,2024-04-23 16:49:49.940271,2024-04-30 16:49:49.940271,open,billing,In expert but ahead local.
58,7814,2024-12-31 09:17:33.551054,2025-01-04 09:17:33.551054,open,billing,Area hard be piece break somebody.
59,1828,2024-07-11 13:04:24.635475,2024-07-19 13:04:24.635475,open,technical,Arm as give article minute old.
60,9637,2023-07-30 10:35:43.065189,2023-08-05 10:35:43.065189,closed,technical,Institution color second.
61,8418,2024-05-28 10:40:33.165043,2024-06-03 10:40:33.165043,open,technical,Hit own show notice when exactly.
62,7950,2023-10-06 13:36:33.546757,2023-10-10 13:36:33.546757,closed,billing,Firm name room control nor people.
63,4547,2024-08-14 20:54:50.635047,2024-08-15 20:54:50.635047,closed,billing,Move all collection camera nearly.
64,6739,2025-04-05 23:46:39.470863,2025-04-12 23:46:39.470863,open,billing,Management morning administration if exist.
65,7154,2025-02-26 14:23:16.165298,2025-03-03 14:23:16.165298,open,billing,Specific mean stuff couple mention fish remember so.
66,3390,2023-07-27 01:53:41.134653,2023-08-01 01:53:41.134653,open,billing,Another various sound under while response.
67,9817,2023-07-07 09:50:40.822820,2023-07-15 09:50:40.822820,open,billing,Find social threat of.
68,3551,2024-12-07 10:05:32.947433,2024-12-11 10:05:32.947433,closed,technical,Plan collection drop into.
69,4014,2024-07-25 07:07:57.553748,2024-07-27 07:07:57.553748,open,billing,Number would to political coach trade.
70,2817,2025-04-15 12:07:24.677300,2025-04-21 12:07:24.677300,closed,technical,Meet rule compare great.
71,4580,2025-01-11 09:35:40.957333,2025-01-15 09:35:40.957333,open,technical,Concern not reduce employee moment while religious move.
72,2373,2024-12-21 17:59:04.195031,2024-12-29 17:59:04.195031,closed,billing,Owner stay enter heavy TV.
73,5215,2023-12-04 14:50:21.133983,2023-12-09 14:50:21.133983,open,technical,Interesting require whole wrong decision wall bag total.
74,44,2024-01-15 22:42:09.385180,2024-01-23 22:42:09.385180,open,technical,Born memory quickly note.
75,2158,2023-10-10 01:28:23.042211,2023-10-19 01:28:23.042211,open,billing,Information into authority forward hand.
76,9360,2024-05-07 07:31:52.607742,2024-05-17 07:31:52.607742,closed,technical,Thus serve dark seven there capital market.
77,3731,2024-01-05 16:53:22.830065,2024-01-06 16:53:22.830065,open,billing,Month here media hot.
78,5778,2023-09-20 17:16:54.572623,2023-09-28 17:16:54.572623,closed,billing,Forward watch specific without.
79,81,2025-01-26 14:59:20.824811,2025-01-30 14:59:20.824811,open,billing,Former begin visit assume chair.
80,8933,2024-03-07 09:29:41.981404,2024-03-10 09:29:41.981404,closed,technical,Few decide actually whether.
81,7828,2024-05-29 21:37:53.817102,2024-06-04 21:37:53.817102,closed,technical,At him financial major put camera friend clearly.
82,9690,2024-02-08 15:44:33.023490,2024-02-13 15:44:33.023490,closed,technical,Send toward bag reflect list generation.
83,3853,2025-05-21 07:00:32.392050,2025-05-29 07:00:32.392050,open,billing,Parent spring marriage occur land.
84,7308,2024-07-25 10:16:03.852155,2024-07-31 10:16:03.852155,closed,billing,Send sister evening however work audience company.
85,5668,2024-08-28 15:02:15.092498,2024-09-05 15:02:15.092498,open,technical,Kitchen owner local friend improve store him.
86,9226,2024-08-06 17:18:35.131918,2024-08-13 17:18:35.131918,closed,billing,Class once new.
87,4292,2023-11-24 14:35:42.652537,2023-11-29 14:35:42.652537,open,billing,Evidence bag prepare trouble play which seem.
88,3487,2023-09-30 19:05:12.015083,2023-10-09 19:05:12.015083,open,technical,Charge rule together ball model.
89,7699,2024-03-15 03:06:32.644369,2024-03-17 03:06:32.644369,open,billing,Rich suffer knowledge order week back.
90,2513,2024-02-03 04:52:32.431007,2024-02-08 04:52:32.431007,closed,technical,Story themselves you fast learn if.
91,922,2025-03-02 01:55:33.492115,2025-03-08 01:55:33.492115,open,technical,Though theory loss west hot.
92,9180,2025-04-26 15:33:06.494675,2025-05-03 15:33:06.494675,open,billing,Guy general baby.
93,4357,2025-02-22 09:55:57.107094,2025-02-27 09:55:57.107094,open,technical,Somebody agreement follow skin tonight style.
94,4537,2024-10-03 10:36:47.999162,2024-10-11 10:36:47.999162,closed,billing,Between because last minute moment challenge table.
95,2276,2024-11-15 22:53:19.089544,2024-11-23 22:53:19.089544,open,billing,Forget test according herself oil finally town.
96,2760,2024-07-12 00:58:55.897099,2024-07-13 00:58:55.897099,closed,billing,Box town available according nearly line.
97,926,2025-01-12 11:21:39.210239,2025-01-17 11:21:39.210239,open,technical,Strategy still short front raise.
98,2463,2025-03-08 02:54:13.262272,2025-03-11 02:54:13.262272,closed,technical,Crime senior enter national forget knowledge memory.
99,9997,2024-05-08 07:33:03.093996,2024-05-15 07:33:03.093996,closed,technical,Natural cup address dog.
100,2749,2025-02-10 06:48:41.112607,2025-02-14 06:48:41.112607,open,billing,Bag break during exist list particular.
101,8757,2024-04-19 15:59:44.533589,2024-04-27 15:59:44.533589,closed,billing,Claim production man since.
102,6048,2023-11-12 15:39:44.463095,2023-11-17 15:39:44.463095,open,billing,Continue process deep away section everybody allow.
103,1957,2024-08-02 06:17:11.507920,2024-08-10 06:17:11.507920,closed,billing,In truth run wait attention girl.
104,5733,2025-04-30 00:18:34.858095,2025-05-02 00:18:34.858095,closed,technical,Administration order per face enjoy great.
105,8917,2023-09-09 01:38:12.213731,2023-09-16 01:38:12.213731,closed,billing,You war stay figure indicate including mention.
106,2347,2024-09-15 22:32:05.559873,2024-09-20 22:32:05.559873,closed,technical,Out hope increase.
107,1893,2023-11-08 03:06:48.912373,2023-11-12 03:06:48.912373,closed,technical,Suffer high school quality age hair.
108,5924,2024-03-26 05:54:18.124074,2024-03-30 05:54:18.124074,open,technical,Onto low get grow.
109,7139,2024-04-26 08:09:38.787343,2024-05-05 08:09:38.787343,closed,technical,Station indeed or speech.
110,8093,2024-12-25 21:43:31.839035,2025-01-01 21:43:31.839035,closed,billing,Born seat create not history pretty.
111,8930,2025-01-30 11:53:23.502405,2025-01-31 11:53:23.502405,closed,technical,Season tend member finally.
112,6109,2025-04-27 08:07:51.107854,2025-04-30 08:07:51.107854,open,billing,But their wrong certain house.
113,3189,2024-04-30 20:06:50.715611,2024-05-06 20:06:50.715611,closed,billing,Manage sense end federal beat sure human.
114,1559,2025-04-01 17:18:22.219555,2025-04-03 17:18:22.219555,open,technical,There yard color marriage store still.
115,2316,2025-04-09 23:02:29.041257,2025-04-14 23:02:29.041257,open,billing,Everybody position born huge job.
116,9232,2024-08-23 14:38:22.847401,2024-08-27 14:38:22.847401,open,technical,Brother expect design ahead attack.
117,6542,2024-12-01 02:05:14.306662,2024-12-11 02:05:14.306662,closed,technical,Situation professor particularly listen until ahead poor half.
118,232,2024-11-25 22:56:23.776784,2024-12-04 22:56:23.776784,closed,billing,Line light always work create become.
119,6677,2023-09-02 07:01:44.150030,2023-09-06 07:01:44.150030,closed,technical,Coach structure detail always.
120,2138,2024-06-07 12:57:28.728295,2024-06-08 12:57:28.728295,open,technical,Trip nearly body left tend.
121,4464,2023-09-01 22:38:46.675219,2023-09-10 22:38:46.675219,closed,technical,Rather television fall million.
122,6796,2023-12-26 23:23:37.744962,2023-12-31 23:23:37.744962,closed,technical,Meeting support card maybe sea president.
123,9473,2023-11-20 00:53:24.868791,2023-11-29 00:53:24.868791,open,billing,Room sure determine system loss eight big.
124,8639,2024-09-19 09:35:00.810380,2024-09-22 09:35:00.810380,open,billing,Control measure green though into.
125,5625,2024-05-27 20:04:49.983908,2024-06-04 20:04:49.983908,open,billing,Hospital professor we full yet analysis suggest.
126,5019,2024-05-07 21:05:31.666904,2024-05-13 21:05:31.666904,open,technical,Side that head.
127,6995,2025-03-11 20:52:21.903731,2025-03-18 20:52:21.903731,open,technical,Pretty fact ago draw husband.
128,2561,2023-08-27 08:58:16.295635,2023-08-31 08:58:16.295635,open,technical,Seat rest laugh instead fill play.
129,6993,2023-07-11 13:55:27.500276,2023-07-13 13:55:27.500276,closed,billing,Field spring study leg plant watch.
130,9283,2024-02-02 05:38:50.049883,2024-02-03 05:38:50.049883,closed,technical,Important road check possible mother remember some.
131,5198,2023-12-05 06:59:18.183233,2023-12-07 06:59:18.183233,closed,technical,Increase federal simple happen.
132,3645,2024-12-02 06:37:56.405793,2024-12-03 06:37:56.405793,open,technical,How say sort stuff other.
133,3970,2024-09-29 00:50:36.361063,2024-10-08 00:50:36.361063,closed,billing,Determine middle voice reveal fund.
134,7940,2025-02-01 02:10:03.714833,2025-02-10 02:10:03.714833,open,technical,Prepare her someone improve.
135,2922,2025-01-26 19:01:17.050434,2025-01-29 19:01:17.050434,open,technical,Security wear everybody sing myself hit.
136,1715,2024-12-30 04:08:35.705910,2025-01-02 04:08:35.705910,closed,technical,Nor court protect billion or entire voice.
137,6253,2023-09-08 17:42:01.450351,2023-09-16 17:42:01.450351,open,billing,Fire system improve several person call question rule.
138,7662,2024-02-27 01:52:04.269964,2024-03-01 01:52:04.269964,closed,billing,Learn great buy artist.
139,1321,2025-04-20 03:46:26.028476,2025-04-23 03:46:26.028476,closed,billing,All kid sell either realize claim walk maybe.
140,6343,2023-12-01 19:25:08.761907,2023-12-08 19:25:08.761907,open,technical,Put give fine large.
141,489,2025-06-29 06:59:37.696765,2025-07-08 06:59:37.696765,open,billing,Cover station news spring appear wait.
142,7056,2024-05-20 23:04:58.606704,2024-05-26 23:04:58.606704,open,technical,Civil now day hear.
143,7284,2024-05-08 23:54:25.298722,2024-05-14 23:54:25.298722,closed,technical,Effect employee movement guy provide contain record.
144,564,2023-09-29 04:37:26.785812,2023-10-03 04:37:26.785812,open,billing,Hospital direction class.
145,6526,2024-11-25 06:25:21.482612,2024-11-28 06:25:21.482612,closed,billing,Pass present service television would.
146,3905,2024-11-17 08:38:59.460609,2024-11-27 08:38:59.460609,closed,billing,Draw newspaper board main.
147,5723,2024-08-21 04:33:15.001027,2024-08-31 04:33:15.001027,closed,billing,Seven past keep.
148,951,2025-02-05 10:59:21.904789,2025-02-13 10:59:21.904789,open,technical,Lot arm policy hotel reason.
149,6734,2023-08-31 21:49:19.182289,2023-09-04 21:49:19.182289,closed,technical,Order stay good answer.
150,2957,2025-04-06 01:45:54.537873,2025-04-16 01:45:54.537873,closed,technical,Number international such third day.
151,4809,2024-06-03 22:44:33.676847,2024-06-12 22:44:33.676847,closed,billing,Return break mission we amount.
152,4678,2025-01-21 03:40:01.092363,2025-01-23 03:40:01.092363,closed,billing,Face number special television law car.
153,7121,2025-02-03 07:42:38.770672,2025-02-13 07:42:38.770672,open,technical,Spend down already these unit represent change.
154,3358,2025-05-21 08:13:47.120310,2025-05-25 08:13:47.120310,closed,billing,Out into left foot.
155,7864,2025-04-29 22:50:40.443991,2025-05-09 22:50:40.443991,closed,billing,Friend street per forget.
156,3083,2024-11-01 15:40:13.160254,2024-11-05 15:40:13.160254,closed,technical,Special heart spend institution trial new page conference.
157,3310,2024-10-15 17:21:34.116948,2024-10-23 17:21:34.116948,closed,technical,Really five pull much.
158,6619,2024-09-19 13:50:35.582755,2024-09-21 13:50:35.582755,open,billing,Color wish management water mission return impact up.
159,7629,2024-04-26 06:32:41.277286,2024-05-04 06:32:41.277286,closed,billing,Color according under wish.
160,1969,2024-09-14 20:14:48.296141,2024-09-19 20:14:48.296141,closed,technical,If old service price suffer at.
161,4917,2024-03-26 03:56:13.792109,2024-04-05 03:56:13.792109,closed,technical,Effect need worker week these keep.
162,7719,2023-07-13 12:44:02.896391,2023-07-23 12:44:02.896391,open,billing,Remain share least take hundred without late.
163,7194,2023-09-30 05:29:38.322967,2023-10-03 05:29:38.322967,closed,technical,Maintain pressure audience now.
164,4225,2025-06-15 14:15:40.298470,2025-06-23 14:15:40.298470,open,technical,Rule must prove officer sure live.
165,9945,2024-01-05 07:30:19.262459,2024-01-08 07:30:19.262459,open,billing,Over against ago travel doctor short audience.
166,9492,2024-01-24 03:26:25.074926,2024-02-01 03:26:25.074926,closed,technical,Raise full decade follow.
167,9664,2024-02-10 09:31:08.795367,2024-02-14 09:31:08.795367,closed,technical,True clearly east determine.
168,7294,2024-06-24 13:53:23.333658,2024-07-01 13:53:23.333658,closed,technical,These price candidate cup economic five certain.
169,1797,2024-01-22 15:45:06.180593,2024-01-30 15:45:06.180593,closed,technical,Director figure eight effect name use billion.
170,3760,2024-10-21 03:40:34.439722,2024-10-23 03:40:34.439722,closed,billing,Especially area boy increase.
171,2562,2024-07-20 11:58:26.402083,2024-07-26 11:58:26.402083,open,technical,Continue professor both.
172,2526,2024-03-10 11:05:41.351728,2024-03-19 11:05:41.351728,closed,technical,Woman term black happy throughout know.
173,2023,2025-01-27 22:53:44.029156,2025-02-03 22:53:44.029156,open,billing,Whose never note live theory organization series.
174,3019,2024-08-06 18:11:20.049424,2024-08-16 18:11:20.049424,closed,technical,Student high loss mention again point economy.
175,4834,2023-10-25 18:11:14.155036,2023-11-04 18:11:14.155036,open,technical,Admit just store.
176,3212,2023-10-04 06:17:49.983738,2023-10-11 06:17:49.983738,open,technical,Member late from.
177,2742,2025-05-17 18:53:49.888163,2025-05-20 18:53:49.888163,open,technical,Mr system personal.
178,8248,2023-12-23 23:20:54.912595,2023-12-28 23:20:54.912595,open,billing,Especially human watch whom so.
179,630,2024-07-06 11:20:06.244873,2024-07-14 11:20:06.244873,closed,technical,Test form by writer stock throw positive.
180,3113,2025-06-19 08:53:39.232841,2025-06-29 08:53:39.232841,open,technical,Back whose your behind poor.
181,5007,2023-12-29 21:56:38.027967,2024-01-07 21:56:38.027967,open,technical,Resource blue others pretty wide Mrs capital side.
182,7886,2024-04-26 00:01:25.387447,2024-04-28 00:01:25.387447,open,billing,Successful or region majority occur.
183,3634,2024-05-17 16:41:18.990752,2024-05-20 16:41:18.990752,open,technical,Room manager newspaper control.
184,2127,2025-03-15 02:43:10.195689,2025-03-22 02:43:10.195689,open,technical,Gun capital difficult health plant.
185,8920,2025-02-08 22:23:19.834306,2025-02-14 22:23:19.834306,open,technical,Can light traditional necessary wrong many prevent.
186,6431,2023-09-08 02:20:17.996149,2023-09-16 02:20:17.996149,open,billing,Course with record out.
187,9901,2024-06-15 15:07:01.774740,2024-06-24 15:07:01.774740,open,billing,Station nothing catch.
188,8770,2024-12-08 15:45:56.833749,2024-12-16 15:45:56.833749,closed,technical,Five character list house certainly foreign PM.
189,7986,2024-03-27 00:57:33.601506,2024-04-03 00:57:33.601506,open,billing,Sit resource she morning.
190,5412,2025-06-29 03:57:53.568756,2025-07-06 03:57:53.568756,open,billing,Party check here world same measure herself.
191,7535,2025-06-16 04:29:30.639374,2025-06-25 04:29:30.639374,open,technical,Certain rock assume moment person sit leg director.
192,4306,2024-09-15 00:49:30.537645,2024-09-18 00:49:30.537645,open,billing,Few give onto word nice expect only.
193,3168,2023-07-11 11:31:17.965832,2023-07-16 11:31:17.965832,open,technical,Scene enjoy will.
194,4475,2023-11-01 17:37:30.295702,2023-11-02 17:37:30.295702,open,technical,Whatever next door arm ground.
195,7477,2025-06-24 19:13:31.477307,2025-07-03 19:13:31.477307,closed,technical,Mention serve friend example trouble protect course.
196,4324,2024-09-20 16:03:45.570516,2024-09-29 16:03:45.570516,open,billing,Rock avoid song because shake with.
197,2627,2023-08-16 19:43:35.214148,2023-08-22 19:43:35.214148,open,technical,Require everything area see baby poor able.
198,7538,2023-09-08 22:23:35.813905,2023-09-16 22:23:35.813905,open,billing,On kitchen I player plant might.
199,3155,2025-03-22 18:56:32.118254,2025-04-01 18:56:32.118254,open,technical,Three or mind education everybody wonder whom.
200,4059,2024-03-19 20:10:55.431281,2024-03-20 20:10:55.431281,closed,billing,Your guess low place operation long pull.
201,9327,2024-01-08 00:32:42.268472,2024-01-18 00:32:42.268472,closed,technical,Director many coach probably PM attack.
202,137,2025-06-02 16:59:10.866167,2025-06-06 16:59:10.866167,closed,billing,Enjoy ok watch against same word.
203,9184,2024-08-14 11:41:10.086896,2024-08-15 11:41:10.086896,open,technical,Chance they least blood fund treat understand.
204,7651,2024-03-09 23:12:26.591149,2024-03-16 23:12:26.591149,closed,technical,Song eye over.
205,1501,2023-12-17 09:29:03.447068,2023-12-27 09:29:03.447068,closed,technical,Support order use alone some exactly hundred.
206,1424,2024-08-10 01:12:18.293139,2024-08-19 01:12:18.293139,open,technical,At break movie nice still design various.
207,7154,2024-05-07 17:11:53.369345,2024-05-16 17:11:53.369345,closed,technical,Mrs development pretty it company since leave.
208,1695,2025-01-27 07:17:54.496351,2025-02-03 07:17:54.496351,open,billing,Church world foreign little support keep.
209,9676,2024-02-20 14:42:54.543559,2024-02-24 14:42:54.543559,closed,technical,Staff board event pay help article.
210,6123,2024-10-27 22:39:55.989413,2024-11-04 22:39:55.989413,closed,technical,Member off city scientist article action.
211,947,2025-01-30 17:33:17.579915,2025-02-07 17:33:17.579915,closed,technical,Prepare prepare law decade change six change view.
212,8299,2023-08-14 12:19:13.905786,2023-08-16 12:19:13.905786,closed,billing,Product measure site themselves small same their.
213,2381,2024-05-10 17:12:23.046289,2024-05-20 17:12:23.046289,closed,billing,Range else establish Congress capital training business.
214,104,2024-03-09 11:07:44.320842,2024-03-18 11:07:44.320842,open,technical,Rock news whom fill until personal change admit.
215,4820,2024-02-18 22:34:45.626388,2024-02-20 22:34:45.626388,closed,billing,Half conference whose back lay political theory could.
216,6329,2023-10-27 07:36:27.715389,2023-10-29 07:36:27.715389,open,billing,Which ever wonder effect.
217,5220,2025-04-26 07:46:39.345655,2025-04-29 07:46:39.345655,closed,billing,As international someone subject air similar summer animal.
218,8234,2024-04-24 09:04:56.846560,2024-05-03 09:04:56.846560,closed,technical,Early strategy industry sit its.
219,9424,2025-06-14 02:35:25.560409,2025-06-22 02:35:25.560409,closed,billing,Sit land truth source happen share doctor.
220,8214,2024-06-14 16:18:33.715090,2024-06-18 16:18:33.715090,closed,technical,Standard value memory fund lead.
221,253,2024-05-26 11:00:16.001218,2024-06-01 11:00:16.001218,closed,technical,Before town today small party story particularly.
222,8889,2024-07-25 22:00:44.651935,2024-08-02 22:00:44.651935,closed,technical,In scientist present onto.
223,6626,2025-03-05 12:03:52.372880,2025-03-08 12:03:52.372880,closed,technical,Economic hotel two although sing happen.
224,8961,2024-10-19 20:27:56.270502,2024-10-20 20:27:56.270502,open,billing,Throw card edge.
225,9063,2025-04-05 12:51:42.421804,2025-04-11 12:51:42.421804,closed,technical,But beat local thought fine wish everybody.
226,5840,2024-07-04 02:14:21.355241,2024-07-09 02:14:21.355241,open,technical,Specific they marriage camera chair here.
