ticket_id,user_id,created_at,resolved_at,status,category,feedback
3582,3844,2025-02-26 06:18:22.676318,2025-03-08 06:18:22.676318,open,technical,Many produce now officer.
3583,635,2024-01-03 19:40:48.773989,2024-01-12 19:40:48.773989,closed,technical,Defense her party health.
3584,7214,2025-06-08 23:49:41.725458,2025-06-16 23:49:41.725458,open,technical,Focus score wear table commercial station.
3585,471,2023-10-30 09:41:39.691217,2023-11-03 09:41:39.691217,open,billing,Of pay today bag.
3586,3333,2024-04-25 03:09:57.827345,2024-04-27 03:09:57.827345,closed,technical,Money century class trade type owner.
3587,4311,2024-04-25 23:58:34.835269,2024-04-29 23:58:34.835269,open,technical,Suggest design not sure movie wear drive.
3588,1392,2024-01-29 14:24:51.344659,2024-02-02 14:24:51.344659,open,technical,Each purpose material rest while support participant decide.
3589,6042,2023-10-13 19:38:09.900098,2023-10-15 19:38:09.900098,open,technical,Mrs operation billion color industry cultural fine.
3590,5092,2025-03-26 01:48:13.496805,2025-03-27 01:48:13.496805,open,billing,Great technology magazine six.
3591,4374,2023-07-22 11:16:43.000506,2023-07-27 11:16:43.000506,open,billing,National arm authority page along save.
3592,9046,2024-11-09 15:41:06.238858,2024-11-16 15:41:06.238858,closed,technical,Us center answer.
3593,523,2025-05-04 05:42:30.295735,2025-05-12 05:42:30.295735,open,technical,Growth throughout remember stage structure.
3594,4877,2024-06-15 08:19:59.220423,2024-06-20 08:19:59.220423,closed,billing,Professional create central teacher could.
3595,3571,2024-09-05 18:34:23.882750,2024-09-09 18:34:23.882750,closed,billing,Report current hundred claim generation.
3596,5738,2024-05-21 02:39:53.297631,2024-05-26 02:39:53.297631,closed,technical,Mouth health laugh have now claim.
3597,7746,2024-08-09 11:51:13.094500,2024-08-11 11:51:13.094500,open,billing,Final local process.
3598,8340,2024-07-29 12:11:18.270933,2024-08-03 12:11:18.270933,closed,technical,Chance southern provide.
3599,9534,2024-01-25 22:16:58.522353,2024-01-27 22:16:58.522353,open,billing,Research story subject movement same food.
3600,3720,2025-01-16 10:27:27.595400,2025-01-26 10:27:27.595400,closed,technical,Area character add believe a.
3601,2987,2024-03-24 14:16:49.151823,2024-04-01 14:16:49.151823,closed,billing,Power wait activity future.
3602,7512,2025-06-06 19:51:57.909773,2025-06-07 19:51:57.909773,closed,billing,Plan job actually.
3603,1462,2023-07-19 09:40:36.984249,2023-07-29 09:40:36.984249,open,billing,Product in trip change artist this country.
3604,2291,2023-12-27 22:46:41.084862,2023-12-28 22:46:41.084862,open,technical,Company fly across kid.
3605,6829,2025-06-24 15:38:21.942861,2025-06-27 15:38:21.942861,open,technical,Really determine where.
3606,9901,2023-08-24 17:41:59.232709,2023-09-02 17:41:59.232709,closed,technical,Long structure recognize such thank.
3607,8188,2023-10-31 18:22:04.614150,2023-11-10 18:22:04.614150,closed,technical,Major imagine tree human drive need culture.
3608,5394,2023-11-05 10:58:36.609402,2023-11-06 10:58:36.609402,open,billing,Argue toward consider study just.
3609,7188,2025-01-17 13:50:06.814238,2025-01-20 13:50:06.814238,closed,technical,Those beat mean catch simple before.
3610,6243,2023-12-01 14:04:57.877712,2023-12-02 14:04:57.877712,closed,billing,Charge discussion box through son discuss prevent.
3611,3520,2023-10-01 07:37:21.139431,2023-10-07 07:37:21.139431,open,billing,Few official number TV product avoid.
3612,2936,2025-05-17 02:57:41.666062,2025-05-21 02:57:41.666062,open,technical,Popular reason magazine picture the financial media security.
3613,6988,2025-05-21 18:36:46.402552,2025-05-27 18:36:46.402552,closed,technical,Quality season concern until hope anyone feel.
3614,225,2023-08-19 10:57:34.060636,2023-08-25 10:57:34.060636,open,billing,His week leave body prove.
3615,8354,2024-06-03 12:19:43.470446,2024-06-11 12:19:43.470446,closed,billing,No money statement here work.
3616,8446,2025-04-03 02:31:56.188880,2025-04-05 02:31:56.188880,open,billing,Wish interesting reduce structure executive day.
3617,5782,2025-06-01 21:35:07.635690,2025-06-07 21:35:07.635690,open,technical,Who whether time compare.
3618,7579,2024-05-09 13:46:20.001715,2024-05-19 13:46:20.001715,open,billing,Development people truth tell product maybe size.
3619,8610,2023-07-07 23:35:49.007411,2023-07-15 23:35:49.007411,closed,technical,Avoid crime whose bill body form change.
3620,2639,2024-03-25 13:50:25.576565,2024-03-26 13:50:25.576565,closed,billing,Really reality herself listen trial.
3621,8445,2025-04-22 14:11:25.686894,2025-05-02 14:11:25.686894,open,technical,Night staff west relationship throughout we.
3622,2463,2024-04-19 12:48:40.594008,2024-04-24 12:48:40.594008,open,billing,Series explain thing a know.
3623,4344,2025-03-06 17:59:38.437594,2025-03-07 17:59:38.437594,closed,billing,Can care still life decide instead pass.
3624,4101,2024-12-13 10:57:23.637595,2024-12-14 10:57:23.637595,open,technical,Simply stock impact research light all.
3625,3903,2024-01-13 14:14:09.620402,2024-01-14 14:14:09.620402,closed,technical,Once statement former right candidate social.
3626,4223,2023-12-20 21:13:05.369865,2023-12-29 21:13:05.369865,open,billing,Make skin by to peace nature.
3627,7821,2024-09-22 14:03:06.705667,2024-09-25 14:03:06.705667,open,technical,Affect common behavior light skin worry.
3628,7236,2024-07-30 10:35:51.946636,2024-08-09 10:35:51.946636,open,billing,Carry church provide whom.
3629,6995,2025-04-25 08:17:24.574646,2025-05-05 08:17:24.574646,open,technical,Challenge real appear best live.
3630,912,2023-08-24 11:40:41.525379,2023-08-26 11:40:41.525379,closed,technical,Ahead several performance memory cup dog rock.
3631,6439,2024-05-12 07:50:05.207514,2024-05-15 07:50:05.207514,closed,billing,Let report western price matter.
3632,2235,2024-07-12 19:40:02.749728,2024-07-19 19:40:02.749728,closed,billing,Look appear thought treat until executive market.
3633,5846,2024-03-08 00:30:41.933853,2024-03-16 00:30:41.933853,open,billing,Task which range.
3634,6845,2024-10-09 11:14:37.725759,2024-10-12 11:14:37.725759,open,technical,Build cup action return either item land candidate.
3635,5040,2023-08-25 23:00:40.408392,2023-09-01 23:00:40.408392,open,billing,Let nothing spring finish store.
3636,7186,2024-03-07 21:18:25.141987,2024-03-15 21:18:25.141987,open,technical,Social herself my listen affect.
3637,7740,2024-06-20 20:06:32.813884,2024-06-29 20:06:32.813884,open,technical,Factor on popular wear.
3638,5682,2023-12-11 13:37:50.698877,2023-12-16 13:37:50.698877,closed,technical,Player treatment much alone material agree.
3639,365,2024-10-08 01:56:16.466125,2024-10-18 01:56:16.466125,open,billing,Sell side society this speak everything foot popular.
3640,6066,2024-05-31 16:56:35.251609,2024-06-08 16:56:35.251609,open,billing,Stage investment ahead appear.
3641,5746,2025-06-15 14:17:19.054505,2025-06-23 14:17:19.054505,closed,billing,Attorney recently value business majority idea create drop.
3642,3480,2025-04-16 23:56:09.120029,2025-04-24 23:56:09.120029,closed,technical,Kind a idea however control wear oil.
3643,4207,2025-02-10 15:36:19.000701,2025-02-19 15:36:19.000701,open,technical,Go wall top heart wish.
3644,6765,2023-10-05 22:42:37.753501,2023-10-07 22:42:37.753501,closed,billing,Where field arm environment whom seem.
3645,6435,2024-10-02 08:50:03.594839,2024-10-11 08:50:03.594839,closed,billing,Treat clearly quality why middle.
3646,593,2024-07-07 20:54:10.375211,2024-07-15 20:54:10.375211,closed,billing,Even task might others example star throughout song.
3647,2840,2024-05-18 03:26:22.671095,2024-05-24 03:26:22.671095,open,billing,Pull raise race character anyone window film.
3648,9678,2024-06-27 08:44:46.505755,2024-06-28 08:44:46.505755,closed,technical,Bring our well maintain.
3649,8286,2024-03-10 20:52:47.427213,2024-03-19 20:52:47.427213,open,technical,Risk number investment win coach training house.
3650,3320,2024-04-25 12:19:10.519786,2024-05-02 12:19:10.519786,open,technical,Concern page drive tell soon fly admit.
3651,4645,2025-03-10 18:07:20.139814,2025-03-20 18:07:20.139814,open,technical,Per edge last everybody along rest firm concern.
3652,22,2024-06-24 01:35:25.745466,2024-07-01 01:35:25.745466,open,billing,Thousand yard chance last medical item star other.
3653,3497,2024-05-17 22:29:11.107512,2024-05-18 22:29:11.107512,open,billing,Reason north school issue.
3654,8689,2024-07-14 16:33:43.710252,2024-07-19 16:33:43.710252,closed,technical,Commercial table rule ability.
3655,1957,2023-10-27 17:09:42.386198,2023-11-01 17:09:42.386198,open,billing,He left social dark.
3656,2408,2024-06-19 22:54:02.816178,2024-06-24 22:54:02.816178,closed,technical,Water movement catch but.
3657,9182,2024-04-19 07:56:38.569526,2024-04-27 07:56:38.569526,closed,technical,Be performance door adult production hit where.
3658,4106,2024-09-19 02:29:22.347131,2024-09-24 02:29:22.347131,closed,technical,Record above day new former discussion.
3659,1774,2023-09-06 12:39:36.680717,2023-09-08 12:39:36.680717,closed,technical,Former risk describe maybe morning.
3660,9356,2025-01-22 09:39:06.621831,2025-01-26 09:39:06.621831,closed,billing,Turn apply side beyond clearly phone key.
3661,3425,2025-05-01 09:30:00.507129,2025-05-05 09:30:00.507129,closed,billing,Whole it painting give difficult expert meeting.
3662,8146,2024-05-20 14:41:47.615078,2024-05-28 14:41:47.615078,closed,technical,Safe leg thus wrong need they notice.
3663,7548,2023-10-11 16:27:26.855497,2023-10-17 16:27:26.855497,open,billing,Glass general shoulder feel tonight investment.
3664,8139,2024-06-06 23:28:02.599259,2024-06-14 23:28:02.599259,closed,billing,Heavy compare learn can development.
3665,906,2024-08-12 00:51:37.863969,2024-08-13 00:51:37.863969,open,billing,Across how film forget create experience space dark.
3666,8616,2025-01-04 10:17:48.747065,2025-01-08 10:17:48.747065,open,billing,Activity fish minute stand list.
3667,3124,2024-11-15 02:59:57.523710,2024-11-23 02:59:57.523710,closed,billing,Region right do.
3668,8317,2023-07-23 04:19:04.450411,2023-07-26 04:19:04.450411,closed,technical,Radio with determine full technology particular.
3669,7907,2024-05-03 17:20:26.138272,2024-05-08 17:20:26.138272,open,technical,Bill ten parent history then claim.
3670,4845,2024-08-07 18:22:21.123429,2024-08-15 18:22:21.123429,open,billing,Executive summer far administration rise bill job recent.
3671,2172,2024-04-07 22:29:11.158371,2024-04-17 22:29:11.158371,open,technical,Crime least alone western add program off.
3672,4318,2024-05-21 19:04:18.749259,2024-05-22 19:04:18.749259,closed,technical,Drug while give walk beyond but people specific.
3673,8018,2025-02-28 04:38:56.797396,2025-03-06 04:38:56.797396,closed,billing,Drive live every me six operation.
3674,2916,2023-10-17 20:04:36.043823,2023-10-25 20:04:36.043823,closed,billing,Series each ball.
3675,1827,2023-08-05 22:49:11.575456,2023-08-11 22:49:11.575456,open,billing,Evidence draw pull arrive particular over six how.
3676,7542,2024-07-26 14:53:23.936321,2024-08-05 14:53:23.936321,closed,billing,Risk time sense fine none simple.
3677,1224,2024-07-24 02:49:49.151027,2024-08-03 02:49:49.151027,closed,billing,Beyond interest choose commercial tend test item.
3678,3754,2024-01-25 02:38:30.199116,2024-01-30 02:38:30.199116,open,technical,System suggest enjoy trade into author.
3679,2849,2024-09-10 16:39:34.298546,2024-09-15 16:39:34.298546,closed,billing,Tell get wrong house under.
3680,7391,2024-10-17 20:08:33.241564,2024-10-25 20:08:33.241564,closed,billing,Try evidence hundred positive.
3681,6999,2023-10-31 09:13:30.027394,2023-11-09 09:13:30.027394,closed,billing,Low Republican loss moment so want son teach.
3682,5663,2024-02-23 23:30:41.433180,2024-03-01 23:30:41.433180,open,technical,Soon space truth push American activity week.
3683,8969,2024-11-08 14:32:37.307317,2024-11-16 14:32:37.307317,open,billing,Turn message begin professional somebody.
3684,525,2024-04-04 16:20:56.988080,2024-04-10 16:20:56.988080,closed,billing,Fire hundred office perhaps glass.
3685,8392,2023-11-02 01:20:38.711488,2023-11-09 01:20:38.711488,open,billing,Full himself man ok start road price.
3686,5663,2024-10-26 20:28:29.896088,2024-11-04 20:28:29.896088,closed,billing,Drive when decision road season.
3687,1237,2025-04-14 00:36:51.193546,2025-04-19 00:36:51.193546,closed,technical,Music run room.
3688,3522,2025-01-14 14:50:38.769260,2025-01-21 14:50:38.769260,closed,technical,Her available skill action.
3689,6117,2023-07-30 15:59:23.132033,2023-08-01 15:59:23.132033,closed,billing,Nature eye perhaps age even safe.
3690,836,2024-11-02 00:46:16.526678,2024-11-12 00:46:16.526678,closed,billing,Get meet discussion total every.
3691,8297,2024-03-15 06:04:37.823076,2024-03-25 06:04:37.823076,open,billing,Class later task maybe adult center trial range.
3692,5392,2024-09-22 13:34:02.590680,2024-09-24 13:34:02.590680,closed,billing,Visit activity many possible find.
3693,695,2023-07-21 14:59:43.098970,2023-07-26 14:59:43.098970,open,billing,Training threat upon special bring.
3694,4031,2023-12-20 15:21:50.347722,2023-12-28 15:21:50.347722,closed,technical,Save work prove conference list cover successful loss.
3695,1360,2023-07-21 10:34:16.789964,2023-07-22 10:34:16.789964,closed,billing,Forward consider vote near difference street.
3696,4292,2024-07-10 02:50:27.463596,2024-07-13 02:50:27.463596,closed,technical,Music future serious on establish mention.
3697,7098,2024-07-11 00:56:26.856050,2024-07-21 00:56:26.856050,closed,technical,Hour subject wide wife lead next include.
3698,583,2024-04-15 10:05:51.587850,2024-04-24 10:05:51.587850,closed,technical,So type foot thousand wide.
3699,1425,2024-01-31 16:34:16.961224,2024-02-04 16:34:16.961224,closed,technical,Memory particular once chair effect concern chair.
3700,780,2024-07-27 19:29:44.683314,2024-08-01 19:29:44.683314,closed,technical,Maybe generation simply character onto president.
3701,2869,2024-08-20 02:51:39.517263,2024-08-21 02:51:39.517263,open,technical,More though TV reality.
3702,9943,2023-09-03 11:49:25.670572,2023-09-04 11:49:25.670572,closed,technical,Produce nation oil themselves.
3703,4801,2023-09-14 16:26:04.135988,2023-09-21 16:26:04.135988,closed,technical,Picture material interest Congress.
3704,8733,2024-08-24 08:45:07.701458,2024-08-28 08:45:07.701458,open,technical,Career want blood property great first piece.
3705,4754,2024-02-16 08:58:25.066722,2024-02-23 08:58:25.066722,open,technical,Computer maybe loss oil hand account also.
3706,2664,2024-11-10 20:19:21.490730,2024-11-18 20:19:21.490730,closed,technical,Beyond ever talk lead why full.
3707,9405,2025-06-09 00:31:20.872139,2025-06-13 00:31:20.872139,open,billing,When factor must mention machine shake.
3708,2339,2025-01-05 10:21:54.491531,2025-01-14 10:21:54.491531,closed,technical,Almost common serve act interview.
3709,84,2024-04-19 23:24:13.944243,2024-04-27 23:24:13.944243,closed,billing,Raise real growth simply boy.
3710,3933,2024-06-26 19:26:09.011649,2024-07-06 19:26:09.011649,closed,billing,Guy walk another yes environment.
3711,4794,2025-04-05 19:05:49.122274,2025-04-12 19:05:49.122274,closed,billing,Service couple picture health trade alone.
3712,3466,2023-09-26 05:57:41.133069,2023-09-29 05:57:41.133069,open,billing,Fast one bar camera it.
3713,7146,2023-12-11 14:05:21.555594,2023-12-20 14:05:21.555594,open,billing,Goal in return record half.
3714,4288,2025-03-24 07:05:55.697318,2025-03-29 07:05:55.697318,open,technical,Place generation adult standard mean.
3715,3133,2024-01-29 21:07:14.548325,2024-02-03 21:07:14.548325,closed,technical,Item white such both where.
3716,9352,2024-03-20 15:02:42.544199,2024-03-26 15:02:42.544199,open,billing,Help money into alone economic apply.
3717,3562,2025-01-20 01:25:01.392854,2025-01-30 01:25:01.392854,closed,technical,Sound ground morning knowledge doctor fund while.
3718,8237,2025-05-08 16:57:48.148543,2025-05-16 16:57:48.148543,open,billing,Time father central special.
3719,3452,2024-10-18 02:50:20.631747,2024-10-25 02:50:20.631747,open,billing,Partner responsibility reflect natural price.
3720,1412,2023-10-25 19:32:17.113442,2023-11-01 19:32:17.113442,open,billing,Painting case tell century trip make.
3721,6864,2024-05-28 19:25:42.199551,2024-06-07 19:25:42.199551,closed,technical,Culture important successful son lead teach.
3722,6695,2024-04-30 06:25:23.659003,2024-05-03 06:25:23.659003,open,technical,Politics hear small ever.
3723,4527,2025-01-02 08:01:53.587828,2025-01-07 08:01:53.587828,closed,billing,Management book no could safe minute miss.
3724,3460,2023-10-28 21:42:07.058615,2023-11-04 21:42:07.058615,open,technical,Million hot all without.
3725,9252,2023-08-09 01:38:14.391655,2023-08-19 01:38:14.391655,closed,billing,But easy together.
3726,5523,2024-08-11 09:50:40.485899,2024-08-18 09:50:40.485899,closed,technical,Direction accept significant take.
3727,9914,2025-01-20 17:40:21.379419,2025-01-23 17:40:21.379419,closed,technical,High or paper look right car.
3728,3515,2023-12-16 21:53:06.316683,2023-12-19 21:53:06.316683,closed,billing,A paper laugh protect discover girl.
3729,5261,2024-12-16 18:27:54.319518,2024-12-22 18:27:54.319518,open,technical,Should society thousand effect open take pretty.
3730,8885,2024-02-17 14:21:38.972059,2024-02-23 14:21:38.972059,open,technical,Guy wall buy fine Congress push structure.
3731,5926,2025-06-15 21:38:01.485880,2025-06-19 21:38:01.485880,closed,technical,Early bag thousand it kid require ago.
3732,2830,2025-04-26 04:55:07.073802,2025-04-29 04:55:07.073802,closed,billing,Specific design enter find.
3733,8610,2024-08-01 16:52:19.293478,2024-08-06 16:52:19.293478,closed,technical,Guy present job dog.
3734,8210,2024-08-09 06:58:08.774827,2024-08-12 06:58:08.774827,closed,technical,Local financial wrong call.
3735,6601,2024-02-21 06:28:32.923857,2024-02-27 06:28:32.923857,closed,technical,Not cut down language.
3736,8955,2024-07-12 10:15:06.616961,2024-07-21 10:15:06.616961,open,billing,Within make young few pull record or.
3737,1299,2025-02-24 01:38:54.494084,2025-03-03 01:38:54.494084,closed,billing,Someone authority whose.
3738,5888,2025-04-04 14:07:46.855230,2025-04-09 14:07:46.855230,open,technical,Campaign tax baby land community.
3739,8535,2024-02-01 14:27:54.903849,2024-02-05 14:27:54.903849,closed,billing,News light must simple usually contain.
3740,9346,2024-08-15 18:55:53.184205,2024-08-25 18:55:53.184205,open,technical,Listen million both notice democratic property.
3741,244,2025-03-25 10:18:38.227273,2025-03-28 10:18:38.227273,open,billing,Child conference Mrs radio type theory.
3742,959,2024-11-22 12:36:33.939116,2024-11-28 12:36:33.939116,open,billing,Until how various continue view.
3743,8785,2024-06-15 04:10:16.158893,2024-06-21 04:10:16.158893,closed,technical,Health seek herself arrive movie together near.
3744,8243,2025-06-22 21:17:22.516760,2025-06-26 21:17:22.516760,open,technical,View inside size past road community citizen.
3745,5056,2025-05-18 20:41:32.051412,2025-05-24 20:41:32.051412,closed,billing,Toward account itself room change think.
3746,1942,2023-10-15 03:37:33.185969,2023-10-25 03:37:33.185969,open,technical,Argue board road support hotel hospital.
3747,6807,2023-10-21 21:37:31.362266,2023-10-30 21:37:31.362266,open,technical,Throughout total our certain ahead night.
3748,162,2023-07-13 18:17:52.350286,2023-07-18 18:17:52.350286,closed,technical,Mrs list use whose.
3749,4735,2024-05-13 21:51:16.415345,2024-05-17 21:51:16.415345,open,billing,Huge into parent out.
3750,439,2024-08-21 11:40:44.073807,2024-08-29 11:40:44.073807,closed,technical,Course event turn man necessary.
3751,1019,2024-01-28 01:04:49.795394,2024-01-31 01:04:49.795394,closed,billing,Series section dog cultural.
3752,5203,2024-08-12 22:56:30.700004,2024-08-19 22:56:30.700004,open,technical,Poor wrong structure mother.
3753,569,2024-02-29 00:14:36.061460,2024-03-08 00:14:36.061460,closed,technical,Give region sound mouth billion wonder.
3754,5700,2024-03-21 06:16:16.168043,2024-03-30 06:16:16.168043,closed,technical,Show police cultural past including listen.
3755,9880,2023-09-18 16:08:04.909120,2023-09-21 16:08:04.909120,open,billing,Wind media television.
3756,6576,2025-03-26 09:14:01.541426,2025-03-29 09:14:01.541426,open,billing,Military make politics manage sport seem technology.
3757,1262,2024-04-22 21:44:17.293360,2024-04-28 21:44:17.293360,open,billing,Sense argue continue response store.
3758,6408,2025-04-26 09:15:26.716221,2025-04-27 09:15:26.716221,open,billing,Participant middle rock part nor remember north.
3759,6441,2023-09-06 14:10:51.320027,2023-09-09 14:10:51.320027,open,billing,Day performance tax sea.
3760,1207,2024-10-12 07:17:29.182820,2024-10-21 07:17:29.182820,closed,billing,National movement society imagine born among thus long.
3761,2488,2025-02-28 10:59:06.010046,2025-03-01 10:59:06.010046,open,technical,Western federal nothing food.
3762,9002,2023-09-28 08:45:43.620011,2023-10-04 08:45:43.620011,closed,billing,Recognize cut nearly hand statement this control show.
3763,1410,2024-07-29 14:32:25.717477,2024-08-04 14:32:25.717477,closed,billing,Sister road about test member continue.
3764,7560,2023-08-31 10:27:08.100600,2023-09-06 10:27:08.100600,closed,technical,True crime first challenge eat.
3765,5646,2024-02-27 05:06:18.033959,2024-03-05 05:06:18.033959,open,billing,Wind result party purpose inside dream environmental player.
3766,2051,2024-04-28 22:20:33.019104,2024-04-30 22:20:33.019104,closed,billing,Time with only part.
3767,8435,2025-04-27 09:42:31.268002,2025-05-05 09:42:31.268002,closed,technical,Side effort course marriage scene last would.
3768,2083,2023-08-02 17:15:15.637255,2023-08-07 17:15:15.637255,closed,technical,Tell western development foreign movie big above.
3769,7662,2024-01-05 03:24:06.386608,2024-01-06 03:24:06.386608,open,billing,Poor majority attorney age film.
3770,519,2025-02-09 02:39:45.539792,2025-02-19 02:39:45.539792,open,billing,Set personal analysis.
3771,2288,2025-04-28 15:39:40.128678,2025-04-29 15:39:40.128678,closed,billing,Common nor vote board.
3772,9406,2024-04-23 11:12:20.190027,2024-05-03 11:12:20.190027,open,billing,Back capital finish live.
3773,1531,2024-08-21 08:00:52.771752,2024-08-31 08:00:52.771752,open,billing,Machine nation detail product skin article.
3774,7460,2023-07-14 02:06:16.169242,2023-07-21 02:06:16.169242,closed,technical,Style stay point actually surface finally education.
3775,8114,2025-06-01 15:01:19.012842,2025-06-03 15:01:19.012842,closed,billing,Including recent adult public leg until.
3776,202,2024-06-09 08:18:05.622993,2024-06-17 08:18:05.622993,open,billing,Between step hospital usually.
3777,1086,2024-09-23 07:25:17.429715,2024-09-26 07:25:17.429715,closed,technical,Serve table personal end pick available.
3778,4881,2024-05-17 22:05:06.244377,2024-05-18 22:05:06.244377,closed,billing,Investment forget as near start six plan.
3779,8134,2024-11-28 10:45:54.345257,2024-12-07 10:45:54.345257,closed,technical,Certainly learn than hope box result protect.
3780,3637,2025-04-05 08:21:02.502225,2025-04-14 08:21:02.502225,open,technical,World section open give half.
3781,4298,2024-12-08 15:39:29.590246,2024-12-16 15:39:29.590246,closed,billing,Sure notice woman everything modern.
3782,3777,2025-01-27 00:40:27.511999,2025-01-30 00:40:27.511999,closed,technical,Can quality hit wall section share.
3783,2057,2025-03-28 14:04:43.466569,2025-03-31 14:04:43.466569,open,technical,Game head assume close cup.
3784,9925,2024-09-07 07:03:55.956729,2024-09-14 07:03:55.956729,open,billing,Page term factor pull enough season.
3785,3399,2023-08-15 08:08:26.368897,2023-08-19 08:08:26.368897,closed,technical,Radio scientist write tax newspaper.
3786,979,2025-04-17 03:38:04.559308,2025-04-27 03:38:04.559308,closed,technical,If glass better admit as miss.
3787,7401,2025-06-17 11:11:59.425955,2025-06-24 11:11:59.425955,open,billing,Stuff check main fight.
3788,9903,2025-05-04 10:08:34.839073,2025-05-12 10:08:34.839073,open,billing,Visit phone east part little.
3789,2379,2025-05-10 03:14:32.363029,2025-05-18 03:14:32.363029,open,billing,Face see measure really though continue part across.
3790,3872,2024-12-11 21:33:17.410832,2024-12-21 21:33:17.410832,closed,technical,You section identify rise.
3791,9865,2025-03-27 16:15:28.218181,2025-03-30 16:15:28.218181,open,technical,New school suffer reduce well.
3792,5451,2025-02-06 10:26:58.095675,2025-02-09 10:26:58.095675,open,technical,News soon type.
3793,3119,2023-11-30 04:17:29.785592,2023-12-09 04:17:29.785592,open,technical,Whom sea sport air day growth source week.
3794,246,2025-06-25 00:58:37.180223,2025-06-27 00:58:37.180223,open,technical,Center other plan able specific indicate.
3795,544,2023-11-22 09:26:02.681632,2023-11-29 09:26:02.681632,closed,technical,Once method half somebody full feeling important.
3796,8933,2025-02-20 13:28:01.220913,2025-03-01 13:28:01.220913,open,billing,After entire billion none social sound.
3797,1093,2024-09-16 16:48:14.568958,2024-09-24 16:48:14.568958,closed,billing,Protect smile hundred street realize around.
3798,7337,2025-05-08 11:18:18.398834,2025-05-18 11:18:18.398834,open,billing,Work need whose force forward recent senior.
3799,226,2024-04-25 06:00:54.100992,2024-05-02 06:00:54.100992,open,technical,Raise both Mrs yard two offer people.
3800,5393,2025-05-21 01:12:17.056618,2025-05-23 01:12:17.056618,closed,billing,Simple itself make laugh meet opportunity glass.
3801,2229,2024-12-21 09:26:35.793855,2024-12-23 09:26:35.793855,open,technical,Soon good low allow one soldier.
3802,7546,2023-12-27 23:02:02.419047,2023-12-29 23:02:02.419047,closed,technical,President should trip course to.
3803,6244,2023-10-16 00:57:09.376939,2023-10-17 00:57:09.376939,open,technical,Very catch expect late at.
3804,9088,2023-12-11 17:23:38.509013,2023-12-15 17:23:38.509013,closed,billing,Turn pattern on there may store need lose.
