ticket_id,user_id,created_at,resolved_at,status,category,feedback
2463,385,2023-10-04 09:49:20.799793,2023-10-12 09:49:20.799793,closed,technical,Suddenly single suffer daughter bank onto quickly.
2464,2500,2024-05-29 04:26:28.840845,2024-06-02 04:26:28.840845,open,technical,Bag young south single price.
2465,2273,2023-11-30 18:27:37.622118,2023-12-07 18:27:37.622118,closed,billing,Series religious southern similar.
2466,409,2024-05-06 17:30:36.889690,2024-05-08 17:30:36.889690,open,technical,Collection learn recent officer family.
2467,3456,2023-08-09 07:34:27.779038,2023-08-19 07:34:27.779038,open,billing,Sometimes position hundred body either close capital middle.
2468,5347,2025-03-20 07:02:50.877540,2025-03-23 07:02:50.877540,open,billing,List ever billion popular here participant particular mention.
2469,330,2023-08-08 23:44:36.364882,2023-08-12 23:44:36.364882,closed,billing,Later beat knowledge agree kid hotel.
2470,7229,2023-09-25 01:18:12.304873,2023-10-03 01:18:12.304873,open,technical,Property hot and book.
2471,1110,2025-05-17 12:23:31.686900,2025-05-25 12:23:31.686900,closed,billing,Well degree federal system.
2472,5588,2025-05-19 18:15:48.961148,2025-05-25 18:15:48.961148,closed,billing,Soon beautiful white institution when.
2473,9761,2023-07-22 19:35:43.591509,2023-07-30 19:35:43.591509,closed,technical,Back against lose.
2474,9368,2024-01-06 05:43:01.577404,2024-01-16 05:43:01.577404,open,technical,Arm town can professional.
2475,3717,2024-12-14 14:43:37.294673,2024-12-19 14:43:37.294673,closed,technical,Mother trouble amount baby visit ask.
2476,2136,2025-06-16 00:28:24.362788,2025-06-24 00:28:24.362788,closed,technical,Pull tend leader large least.
2477,714,2024-09-14 06:02:28.238638,2024-09-19 06:02:28.238638,closed,billing,Daughter political onto research.
2478,1639,2024-06-22 23:29:49.512378,2024-06-26 23:29:49.512378,closed,billing,Support up upon green writer.
2479,88,2024-04-16 20:08:01.880954,2024-04-17 20:08:01.880954,open,billing,Weight race score pressure able want condition.
2480,5899,2024-05-06 04:06:21.237847,2024-05-11 04:06:21.237847,closed,billing,Since record attention seem for face who.
2481,6427,2024-02-07 00:37:29.899172,2024-02-08 00:37:29.899172,closed,technical,Ok right save not.
2482,2523,2023-11-09 15:39:19.184013,2023-11-17 15:39:19.184013,closed,billing,No set these trade perhaps them.
2483,7522,2023-07-27 21:22:25.187250,2023-07-28 21:22:25.187250,open,technical,Young two rise.
2484,8741,2025-07-02 15:49:48.232907,2025-07-11 15:49:48.232907,open,billing,Skin why majority up agency spring.
2485,6602,2023-10-08 19:02:48.835729,2023-10-16 19:02:48.835729,open,technical,Sister many business simple few base since.
2486,8734,2023-12-12 01:40:47.216763,2023-12-20 01:40:47.216763,open,billing,Her management turn many.
2487,1235,2025-02-10 04:04:42.238021,2025-02-19 04:04:42.238021,open,technical,Mother area one positive society green thus animal.
2488,4233,2024-07-15 02:13:46.090812,2024-07-17 02:13:46.090812,open,billing,Raise natural attack together ago.
2489,4632,2024-03-13 04:42:16.287904,2024-03-19 04:42:16.287904,open,technical,Resource join rise edge.
2490,177,2025-03-01 13:12:49.263242,2025-03-05 13:12:49.263242,open,billing,Major soldier partner popular news.
2491,3104,2024-01-12 05:30:24.642891,2024-01-17 05:30:24.642891,open,technical,Beyond professor away tree.
2492,8836,2023-08-17 11:09:29.355979,2023-08-24 11:09:29.355979,open,billing,Travel almost suggest might skill.
2493,6452,2025-05-08 10:51:20.622257,2025-05-14 10:51:20.622257,closed,billing,Every PM executive middle best open walk.
2494,930,2023-09-15 06:23:19.729531,2023-09-21 06:23:19.729531,closed,technical,Although firm western down.
2495,7098,2024-04-19 00:57:51.062533,2024-04-21 00:57:51.062533,closed,billing,Win life street performance walk.
2496,8367,2024-06-07 18:49:33.442382,2024-06-13 18:49:33.442382,open,technical,Join far rate during military region.
2497,4933,2024-02-17 11:20:06.949677,2024-02-18 11:20:06.949677,open,technical,Attention seem mind happen use none evening.
2498,8326,2024-01-31 17:23:37.349646,2024-02-01 17:23:37.349646,closed,billing,Actually end partner.
2499,3971,2024-03-22 00:54:11.537791,2024-03-23 00:54:11.537791,open,billing,Threat cold beyond practice beat design popular.
2500,8123,2023-11-17 12:47:18.086145,2023-11-25 12:47:18.086145,closed,technical,Indicate behavior world note top.
2501,3872,2023-10-14 20:15:40.799106,2023-10-21 20:15:40.799106,open,technical,Three until investment oil quite citizen me.
2502,9020,2024-09-08 05:06:50.687208,2024-09-10 05:06:50.687208,open,technical,Medical fall various standard nor threat right look.
2503,3389,2025-03-09 14:45:09.864820,2025-03-15 14:45:09.864820,open,billing,Person follow election.
2504,2066,2024-05-12 15:30:33.657723,2024-05-15 15:30:33.657723,closed,billing,Chair statement move government deal dinner newspaper.
2505,3092,2025-04-18 14:18:39.627939,2025-04-22 14:18:39.627939,open,technical,Owner create although region finish teacher.
2506,64,2025-04-18 01:34:51.246361,2025-04-25 01:34:51.246361,closed,billing,Hard evening fight sign beautiful change.
2507,8340,2025-04-07 20:40:47.481483,2025-04-11 20:40:47.481483,closed,billing,Arrive them box return everything range pressure.
2508,5961,2023-10-01 05:57:41.914662,2023-10-08 05:57:41.914662,open,billing,Energy trial maintain response indicate.
2509,5354,2024-03-20 20:01:50.766966,2024-03-27 20:01:50.766966,closed,technical,Today big quality table.
2510,2461,2024-09-06 19:32:11.075033,2024-09-10 19:32:11.075033,closed,technical,Election expect meeting way room month.
2511,5094,2024-06-05 00:09:54.413136,2024-06-08 00:09:54.413136,closed,billing,Stock window soon toward.
2512,5295,2025-03-01 02:50:03.276689,2025-03-02 02:50:03.276689,open,technical,Occur them my area.
2513,7801,2024-12-08 11:00:04.498323,2024-12-11 11:00:04.498323,open,billing,Enjoy news rich always.
2514,2144,2024-07-29 20:44:35.970957,2024-07-30 20:44:35.970957,closed,technical,Home reduce shake with.
2515,493,2023-12-31 02:57:10.867391,2024-01-09 02:57:10.867391,open,technical,And interview television rock keep up treat.
2516,286,2023-10-08 23:16:02.293641,2023-10-14 23:16:02.293641,open,billing,Material so four car drop physical catch whose.
2517,8052,2023-09-09 01:48:26.946287,2023-09-13 01:48:26.946287,closed,technical,Life peace various within coach very military west.
2518,5645,2025-02-06 12:09:01.175867,2025-02-13 12:09:01.175867,open,billing,Detail clearly economic end certain significant own.
2519,9385,2024-11-30 15:48:32.467725,2024-12-10 15:48:32.467725,closed,technical,East student simply fire west help.
2520,4764,2023-12-10 14:02:50.168020,2023-12-12 14:02:50.168020,open,technical,Left marriage without resource discussion although scene.
2521,311,2025-02-13 17:40:23.544734,2025-02-23 17:40:23.544734,closed,billing,Think recent city company admit lead.
2522,1296,2023-08-25 11:06:01.419137,2023-09-04 11:06:01.419137,open,billing,Rule future involve admit easy long sister.
2523,8426,2025-05-31 17:35:59.465931,2025-06-08 17:35:59.465931,closed,technical,Store him allow long speak.
2524,6200,2024-06-16 08:10:40.767456,2024-06-17 08:10:40.767456,closed,technical,Program protect wind late husband issue poor.
2525,873,2024-09-28 23:08:35.868378,2024-10-04 23:08:35.868378,open,technical,Fund summer staff bag.
2526,6716,2025-04-02 21:46:34.309485,2025-04-11 21:46:34.309485,closed,technical,Air throw only follow rule into.
2527,5371,2024-07-15 20:25:34.280997,2024-07-24 20:25:34.280997,open,billing,Begin upon might should customer.
2528,5599,2024-09-07 01:16:40.731333,2024-09-09 01:16:40.731333,closed,technical,Appear really behavior.
2529,2913,2023-12-10 21:54:14.983604,2023-12-18 21:54:14.983604,open,billing,Behind animal grow play understand order.
2530,1518,2024-09-30 13:03:19.761222,2024-10-05 13:03:19.761222,open,technical,Present goal laugh.
2531,4584,2024-04-26 12:48:13.780831,2024-04-28 12:48:13.780831,closed,billing,Mission newspaper however season husband memory.
2532,9149,2025-03-04 13:47:22.712944,2025-03-05 13:47:22.712944,closed,billing,Issue teacher top network star often find.
2533,2222,2025-06-10 10:24:19.217572,2025-06-18 10:24:19.217572,open,technical,Spring home floor long.
2534,4377,2024-01-16 17:23:19.822290,2024-01-26 17:23:19.822290,open,billing,Expect democratic president despite parent entire.
2535,9334,2024-10-19 04:37:59.950305,2024-10-28 04:37:59.950305,closed,technical,Leg join at cultural.
2536,1563,2023-09-03 09:45:33.772009,2023-09-13 09:45:33.772009,closed,billing,Entire sense despite you grow cultural.
2537,7906,2023-07-17 17:03:47.385190,2023-07-19 17:03:47.385190,open,technical,Character interesting letter summer attention film.
2538,9972,2024-07-23 20:44:45.541634,2024-07-26 20:44:45.541634,closed,technical,Option father several religious.
2539,8242,2024-10-11 23:31:00.785548,2024-10-19 23:31:00.785548,open,technical,Front final cold best southern threat network.
2540,5954,2024-10-23 05:47:26.830181,2024-11-02 05:47:26.830181,closed,billing,Poor after style hold security president.
2541,263,2024-10-25 19:13:39.002141,2024-10-31 19:13:39.002141,closed,billing,Know single or huge.
2542,9807,2024-03-18 03:49:06.729929,2024-03-22 03:49:06.729929,open,billing,Defense court fish various.
2543,9208,2024-02-20 22:30:57.615325,2024-02-27 22:30:57.615325,closed,billing,Which water beyond I paper.
2544,6472,2025-01-17 12:05:33.021662,2025-01-19 12:05:33.021662,closed,billing,Population example knowledge my.
2545,1973,2024-04-14 02:10:02.003236,2024-04-24 02:10:02.003236,closed,technical,Loss run option stock mother federal do.
2546,6985,2025-02-09 17:16:24.414615,2025-02-13 17:16:24.414615,closed,technical,Show its key surface should.
2547,7551,2024-06-09 09:41:34.044229,2024-06-14 09:41:34.044229,closed,technical,Sure society Democrat that agency behavior.
2548,7347,2024-05-10 23:51:57.563887,2024-05-13 23:51:57.563887,open,technical,Listen another more impact cup.
2549,6851,2023-09-30 04:49:04.628288,2023-10-01 04:49:04.628288,open,technical,Before election career material record door near.
2550,4335,2024-10-02 00:38:21.206553,2024-10-10 00:38:21.206553,closed,technical,Individual mind blood.
2551,2764,2024-10-12 18:21:17.625978,2024-10-13 18:21:17.625978,closed,technical,Tv property official activity matter blood like community.
2552,2846,2024-09-26 17:26:40.053364,2024-10-01 17:26:40.053364,closed,technical,Trip thank war mouth.
2553,9058,2023-12-25 23:55:06.507549,2023-12-29 23:55:06.507549,closed,billing,Economic feeling work last senior.
2554,3405,2024-12-12 23:13:18.286021,2024-12-16 23:13:18.286021,closed,technical,Official remember kitchen white staff actually peace.
2555,2065,2025-03-22 20:51:40.032795,2025-03-28 20:51:40.032795,open,technical,Mean national deep.
2556,1340,2024-12-25 12:32:49.332486,2024-12-30 12:32:49.332486,open,billing,Senior off prepare at left keep deep.
2557,953,2024-12-02 09:50:19.069747,2024-12-08 09:50:19.069747,open,technical,Worry walk gas help cost to.
2558,7999,2024-01-18 20:47:26.246789,2024-01-25 20:47:26.246789,closed,technical,Summer add themselves form goal strategy six drug.
2559,3391,2024-07-07 23:45:16.270430,2024-07-09 23:45:16.270430,open,technical,Listen anyone reduce current gas.
2560,7722,2023-07-15 13:26:52.168605,2023-07-25 13:26:52.168605,closed,billing,Enter meeting information anything.
2561,4913,2024-09-12 20:11:22.168530,2024-09-17 20:11:22.168530,closed,technical,Turn some purpose.
2562,1513,2025-06-21 12:12:58.505049,2025-06-27 12:12:58.505049,closed,technical,However sure skill real.
2563,2880,2023-11-04 14:09:56.411390,2023-11-06 14:09:56.411390,open,technical,Air wish child movement challenge.
2564,6089,2023-10-17 09:17:07.885892,2023-10-22 09:17:07.885892,closed,technical,Word interest tax wish deep put thousand.
2565,9253,2024-02-28 05:16:45.073576,2024-03-07 05:16:45.073576,closed,technical,Decision sit girl participant bag majority.
2566,7596,2025-05-20 07:52:49.951519,2025-05-23 07:52:49.951519,closed,billing,Dinner mother recognize read particular his base.
2567,7631,2024-04-05 14:07:08.053690,2024-04-09 14:07:08.053690,closed,billing,What night how Mrs condition say resource.
2568,9321,2024-03-18 06:43:19.300566,2024-03-26 06:43:19.300566,open,technical,Against professor particularly spend citizen option.
2569,199,2024-02-12 07:44:38.758932,2024-02-13 07:44:38.758932,open,billing,Name tree bit light its.
2570,5466,2024-07-01 11:02:39.936145,2024-07-11 11:02:39.936145,open,technical,There test say.
2571,9077,2025-06-30 10:36:52.722732,2025-07-03 10:36:52.722732,closed,technical,Late media everyone rather your ball race.
2572,2060,2024-12-04 07:24:22.929685,2024-12-09 07:24:22.929685,open,technical,Ready second only current claim dark your.
2573,7130,2023-11-03 03:34:35.482613,2023-11-10 03:34:35.482613,closed,billing,Themselves close father door subject phone.
2574,6768,2025-04-01 14:39:37.695340,2025-04-08 14:39:37.695340,open,billing,Street hour of financial study company feel.
2575,7439,2024-10-31 14:20:21.648170,2024-11-05 14:20:21.648170,open,technical,Share campaign campaign class police dark short.
2576,1595,2024-11-10 08:38:23.034464,2024-11-16 08:38:23.034464,open,technical,Left the boy.
2577,2405,2023-10-14 05:24:05.967892,2023-10-15 05:24:05.967892,open,technical,Father find various magazine power.
2578,6778,2024-04-24 12:19:55.649439,2024-04-25 12:19:55.649439,closed,technical,Particular lot him hair help development check.
2579,9857,2023-07-07 05:02:02.455834,2023-07-16 05:02:02.455834,open,billing,Fine decide your stay rate.
2580,6976,2025-02-06 21:19:56.164771,2025-02-07 21:19:56.164771,closed,technical,Late administration hair then recognize.
2581,9752,2024-03-08 12:43:13.863501,2024-03-15 12:43:13.863501,closed,billing,One may trouble realize reduce hand far.
2582,7893,2024-08-06 13:20:56.419133,2024-08-09 13:20:56.419133,open,billing,Top mother laugh what simple clearly seven.
2583,73,2025-01-10 18:13:22.752258,2025-01-20 18:13:22.752258,open,technical,Ten try be.
2584,8092,2025-05-20 17:54:35.930656,2025-05-26 17:54:35.930656,closed,billing,Middle analysis first site item.
2585,8304,2024-10-08 07:05:18.988361,2024-10-18 07:05:18.988361,closed,technical,Very lot across edge as boy his.
2586,5285,2025-04-16 20:16:12.298850,2025-04-19 20:16:12.298850,closed,technical,Opportunity possible pressure.
2587,3032,2024-01-20 02:59:42.860975,2024-01-27 02:59:42.860975,closed,billing,Around chance management measure stay.
2588,4694,2024-10-10 01:10:43.435591,2024-10-14 01:10:43.435591,closed,billing,Employee side traditional describe answer walk.
2589,7791,2023-10-16 05:35:04.788976,2023-10-25 05:35:04.788976,closed,technical,Study of around develop rich tax.
2590,9115,2024-04-16 10:36:34.868882,2024-04-17 10:36:34.868882,open,technical,Performance test seat.
2591,8968,2025-05-07 11:47:51.782156,2025-05-10 11:47:51.782156,open,billing,Week back kitchen certain billion.
2592,458,2024-05-16 11:05:20.712396,2024-05-25 11:05:20.712396,open,technical,Wrong east present team decade power political.
2593,5287,2024-07-15 14:00:53.070199,2024-07-23 14:00:53.070199,closed,technical,Past produce current behavior our.
2594,3639,2025-01-09 14:39:47.931874,2025-01-13 14:39:47.931874,closed,billing,Increase interest establish there nation.
2595,6950,2023-12-10 04:55:20.061843,2023-12-11 04:55:20.061843,open,technical,Leader former bag late strategy.
2596,4481,2025-06-30 05:59:29.598929,2025-07-05 05:59:29.598929,open,technical,House eight TV.
2597,3912,2025-06-28 15:14:07.350086,2025-06-29 15:14:07.350086,closed,billing,Issue drop sing station skill activity economic.
2598,9975,2024-03-18 11:10:27.629703,2024-03-25 11:10:27.629703,open,billing,I heart each purpose keep.
2599,3785,2024-09-23 00:41:48.288941,2024-09-30 00:41:48.288941,open,billing,But politics fine make compare within time.
2600,4165,2023-11-08 13:30:28.206892,2023-11-13 13:30:28.206892,closed,billing,Perform such box policy weight account travel.
2601,4712,2025-06-09 22:44:51.170442,2025-06-11 22:44:51.170442,closed,billing,About hope guess standard necessary them.
2602,6563,2024-10-02 06:26:20.284715,2024-10-09 06:26:20.284715,closed,technical,Magazine message goal difference old catch compare.
2603,6046,2025-05-14 18:56:25.086508,2025-05-18 18:56:25.086508,closed,billing,Glass single rock nice example friend.
2604,318,2024-03-16 02:24:15.454850,2024-03-20 02:24:15.454850,open,billing,Newspaper year scientist would.
2605,513,2024-06-07 04:11:36.171966,2024-06-09 04:11:36.171966,open,billing,Scientist bill image effect direction eight provide.
2606,4034,2024-07-06 08:07:20.375369,2024-07-15 08:07:20.375369,closed,billing,Machine once recent anyone camera next affect.
2607,2956,2024-02-28 13:01:09.397837,2024-03-03 13:01:09.397837,open,technical,Second product number benefit.
2608,8098,2024-02-08 23:55:46.924288,2024-02-18 23:55:46.924288,open,billing,Seven teach world.
2609,5255,2023-10-18 01:04:24.675700,2023-10-21 01:04:24.675700,closed,billing,Pick five star control prove give image.
2610,9056,2023-09-07 06:39:51.283798,2023-09-11 06:39:51.283798,open,technical,Rich over they east yard kitchen.
2611,9082,2023-08-03 07:12:10.584254,2023-08-08 07:12:10.584254,open,billing,Book force spring outside rather green long.
2612,6475,2024-12-08 14:38:53.330771,2024-12-16 14:38:53.330771,closed,billing,Year discussion memory budget generation home area.
2613,9754,2023-09-09 11:36:02.733021,2023-09-10 11:36:02.733021,open,billing,Become nothing exactly head sure.
2614,8885,2023-09-06 02:21:01.661305,2023-09-11 02:21:01.661305,open,billing,Cut receive soon whose view less significant certain.
2615,6827,2024-09-05 19:05:19.909145,2024-09-13 19:05:19.909145,open,technical,Good for despite nature eat avoid drive.
2616,8948,2025-01-17 23:54:10.135400,2025-01-19 23:54:10.135400,closed,billing,More inside central charge.
2617,2107,2025-01-27 11:53:33.124088,2025-01-28 11:53:33.124088,closed,technical,Owner accept act person material.
2618,4042,2025-01-02 04:34:40.424646,2025-01-10 04:34:40.424646,closed,billing,Nature fall other fact activity stuff.
2619,2457,2023-11-02 11:48:01.459521,2023-11-04 11:48:01.459521,open,technical,Able sometimes current social thank piece.
2620,8096,2025-06-11 09:02:45.249582,2025-06-16 09:02:45.249582,open,billing,Assume pretty film there.
2621,8590,2025-06-16 16:38:11.882689,2025-06-22 16:38:11.882689,closed,billing,Us truth light goal.
2622,249,2025-05-20 06:08:03.937939,2025-05-30 06:08:03.937939,open,technical,Seem around officer cold value lose.
2623,1640,2024-03-01 12:36:27.659893,2024-03-07 12:36:27.659893,open,technical,He particularly full bar team.
2624,1840,2024-04-27 09:01:17.148904,2024-04-29 09:01:17.148904,closed,billing,Upon check state world hope prepare area.
2625,3514,2024-09-19 09:18:17.091267,2024-09-20 09:18:17.091267,closed,technical,Professor Mrs itself executive.
2626,7364,2024-12-05 06:32:56.378117,2024-12-13 06:32:56.378117,open,technical,Actually move life necessary including sometimes.
2627,627,2024-12-09 10:56:13.904258,2024-12-14 10:56:13.904258,open,technical,Final prepare cost possible pressure.
2628,9953,2025-02-24 18:44:15.807427,2025-03-01 18:44:15.807427,closed,billing,Thought yes whatever.
2629,1094,2024-01-04 20:26:43.189854,2024-01-14 20:26:43.189854,open,technical,Director collection air near.
2630,4702,2023-09-28 19:43:46.243007,2023-10-01 19:43:46.243007,open,technical,Claim generation stay official investment admit.
2631,2151,2025-04-07 21:41:28.879065,2025-04-10 21:41:28.879065,closed,billing,Hundred include book realize keep rock amount.
2632,9312,2024-11-01 23:06:38.926861,2024-11-07 23:06:38.926861,open,technical,Better how particularly tough would worry option.
2633,9616,2025-01-08 05:02:32.104826,2025-01-14 05:02:32.104826,closed,technical,Four plan center.
2634,6590,2023-09-12 02:45:12.977407,2023-09-14 02:45:12.977407,closed,billing,Interest live owner movie billion heavy.
2635,5786,2023-11-08 10:18:35.264518,2023-11-09 10:18:35.264518,open,billing,Skin writer everything machine between air fire.
2636,321,2024-07-06 08:42:50.935100,2024-07-09 08:42:50.935100,open,billing,Seat son economy fast enjoy PM effort.
2637,4512,2025-06-23 08:49:22.257841,2025-06-29 08:49:22.257841,open,technical,Wife none mention.
2638,373,2024-12-20 09:17:30.986257,2024-12-28 09:17:30.986257,open,billing,Maintain say public sense.
2639,4883,2023-11-15 23:42:58.769674,2023-11-21 23:42:58.769674,open,billing,Move enough much investment surface almost forward.
2640,3419,2023-09-08 17:42:29.417780,2023-09-12 17:42:29.417780,open,billing,Catch often wind.
2641,8790,2024-12-26 19:20:28.544673,2025-01-03 19:20:28.544673,open,technical,Court election when seem develop.
2642,1686,2024-08-02 11:56:54.369452,2024-08-06 11:56:54.369452,open,billing,Very develop visit without develop all ball.
2643,3972,2023-07-05 01:55:36.458999,2023-07-06 01:55:36.458999,open,technical,Son card sport same.
2644,8362,2024-03-14 08:07:57.163130,2024-03-18 08:07:57.163130,open,billing,Green interview teacher special.
2645,8844,2025-01-23 19:08:03.442349,2025-01-24 19:08:03.442349,closed,technical,Page rest high born a.
2646,6472,2023-08-12 10:46:04.528326,2023-08-16 10:46:04.528326,open,technical,Dinner Mrs training.
2647,5289,2024-09-29 07:08:12.272671,2024-10-03 07:08:12.272671,closed,technical,Kind floor carry seem.
2648,9326,2024-03-21 18:46:49.715961,2024-03-30 18:46:49.715961,closed,billing,Security everyone fact ever hear sing adult.
2649,1792,2025-06-14 03:33:36.364070,2025-06-17 03:33:36.364070,closed,technical,Phone bring rule really personal car two else.
2650,293,2025-06-27 07:12:17.859317,2025-07-04 07:12:17.859317,closed,billing,Here security type light dog either receive.
2651,9744,2025-05-19 08:09:26.755880,2025-05-28 08:09:26.755880,closed,billing,Authority offer available speech amount similar.
2652,3391,2023-11-25 00:31:31.873468,2023-12-04 00:31:31.873468,open,billing,Husband myself expert interview seem.
2653,7100,2024-10-24 13:33:22.060119,2024-11-03 13:33:22.060119,open,billing,Teach commercial finally computer step act.
2654,114,2025-03-13 02:26:17.640027,2025-03-14 02:26:17.640027,open,technical,Arrive kind thing no.
2655,4968,2025-03-08 03:22:45.027137,2025-03-12 03:22:45.027137,open,technical,Decade relate measure than end cold main.
2656,8282,2024-01-10 10:50:24.787332,2024-01-17 10:50:24.787332,closed,technical,Player thus military once surface campaign.
2657,2658,2024-11-01 08:19:46.341857,2024-11-10 08:19:46.341857,open,billing,Ever I interest use.
2658,8495,2024-08-25 20:47:06.943994,2024-08-31 20:47:06.943994,open,technical,Any small five.
2659,6039,2024-05-17 19:47:53.826397,2024-05-21 19:47:53.826397,closed,billing,Pick character director.
2660,7827,2023-09-21 07:02:36.309442,2023-09-30 07:02:36.309442,open,technical,Party true official green.
2661,7106,2024-06-19 11:39:21.641536,2024-06-24 11:39:21.641536,open,billing,Town within picture sense culture great him.
2662,9242,2024-08-25 19:44:49.922645,2024-08-26 19:44:49.922645,open,technical,Increase space natural seven.
2663,3401,2023-10-21 13:15:24.903618,2023-10-25 13:15:24.903618,open,billing,Myself prove voice along public owner age similar.
2664,3713,2024-02-18 08:01:07.964698,2024-02-24 08:01:07.964698,closed,technical,Standard structure growth other.
2665,7408,2023-11-06 15:04:14.965237,2023-11-10 15:04:14.965237,open,technical,Since some month same company office however.
2666,5818,2024-01-01 22:56:26.984651,2024-01-06 22:56:26.984651,open,technical,Tree allow most color.
2667,6828,2024-01-01 21:01:17.802859,2024-01-07 21:01:17.802859,open,billing,Arrive local small interview option degree game.
2668,7790,2023-09-30 18:22:21.252933,2023-10-07 18:22:21.252933,closed,technical,Offer environmental perform institution better pressure offer.
2669,8120,2024-10-09 03:03:00.914990,2024-10-11 03:03:00.914990,closed,billing,Management rise message environmental mission whose.
2670,293,2024-05-29 06:29:06.402628,2024-05-30 06:29:06.402628,closed,technical,Occur though majority land tend.
2671,3105,2024-04-18 09:42:28.776877,2024-04-28 09:42:28.776877,closed,technical,Security happen store level.
2672,4091,2023-11-03 00:36:56.437124,2023-11-07 00:36:56.437124,closed,billing,Current create sound specific television newspaper.
2673,6296,2023-12-18 19:48:17.737378,2023-12-19 19:48:17.737378,closed,billing,Discuss least point.
2674,1758,2025-06-11 00:43:58.723215,2025-06-18 00:43:58.723215,open,technical,Treatment start project owner drive year blue.
2675,3743,2024-05-11 21:55:40.316313,2024-05-13 21:55:40.316313,open,technical,I let can into.
2676,409,2024-10-08 15:43:02.515797,2024-10-10 15:43:02.515797,closed,technical,Still world environment light particular reality here.
2677,1831,2024-10-14 01:36:44.275348,2024-10-22 01:36:44.275348,closed,technical,Drop structure however as thousand along.
2678,2116,2023-10-12 00:49:43.780139,2023-10-22 00:49:43.780139,open,technical,Both rule part position popular as bill.
2679,2699,2024-05-01 13:09:19.864120,2024-05-05 13:09:19.864120,open,billing,West entire stuff again research away.
2680,2918,2024-07-15 09:45:51.646510,2024-07-16 09:45:51.646510,open,technical,Hotel race site street company.
2681,5445,2024-04-09 08:29:47.896203,2024-04-19 08:29:47.896203,closed,billing,Hot role hot yard continue would.
2682,3197,2024-02-28 03:05:07.129542,2024-03-05 03:05:07.129542,closed,technical,Off girl out himself.
2683,8250,2025-02-03 00:41:35.936527,2025-02-05 00:41:35.936527,closed,billing,These old house will page light continue.
2684,6233,2024-10-15 06:56:58.293418,2024-10-22 06:56:58.293418,closed,technical,My mention something player there happy.
2685,5158,2023-12-24 10:47:45.682750,2024-01-02 10:47:45.682750,open,billing,Realize she reach large control someone two class.
2686,334,2024-04-13 19:39:29.002236,2024-04-22 19:39:29.002236,closed,billing,Million ahead guy TV common want.
