ticket_id,user_id,created_at,resolved_at,status,category,feedback
1351,7722,2023-09-20 03:47:41.540242,2023-09-30 03:47:41.540242,open,technical,Life reality yeah glass main score list when.
1352,3767,2025-03-28 18:54:29.127430,2025-04-02 18:54:29.127430,closed,billing,Either final life Congress computer air whom later.
1353,4054,2024-06-03 15:17:30.723599,2024-06-04 15:17:30.723599,closed,technical,Other student treat fact eat itself edge.
1354,1061,2024-07-02 16:38:29.810923,2024-07-06 16:38:29.810923,open,technical,These source recognize machine result decade meet.
1355,8483,2025-02-10 16:05:42.982691,2025-02-20 16:05:42.982691,open,technical,Represent nation plan customer seven image choice.
1356,9103,2024-01-24 06:31:02.304682,2024-02-03 06:31:02.304682,open,billing,Open coach wonder smile campaign down.
1357,2059,2025-01-02 04:43:08.791230,2025-01-11 04:43:08.791230,closed,technical,West white though thus list.
1358,9635,2024-03-20 17:26:00.892492,2024-03-25 17:26:00.892492,closed,technical,Finish response Mr conference cup me yet.
1359,7908,2023-12-29 10:34:51.212933,2024-01-03 10:34:51.212933,open,billing,Create place relate lose clearly successful.
1360,6490,2023-07-09 15:15:21.108454,2023-07-17 15:15:21.108454,closed,technical,Wide theory least enjoy go front.
1361,1753,2025-03-06 03:22:33.849142,2025-03-12 03:22:33.849142,open,billing,Hour say politics with less become very.
1362,5458,2024-10-12 13:06:29.010713,2024-10-13 13:06:29.010713,open,technical,Mother away never idea which lawyer while.
1363,7293,2024-09-16 19:18:36.525819,2024-09-21 19:18:36.525819,closed,technical,Lose play third partner billion whom.
1364,1122,2024-06-02 21:55:32.354966,2024-06-05 21:55:32.354966,closed,technical,Full people past I ability.
1365,5265,2024-09-30 07:23:17.601737,2024-10-04 07:23:17.601737,open,technical,Election bad bill play pay.
1366,9420,2025-04-02 10:31:11.442281,2025-04-08 10:31:11.442281,open,technical,Manage create lose raise left.
1367,8448,2023-07-29 06:58:42.700750,2023-08-05 06:58:42.700750,open,technical,Hundred enjoy whether mention recent suddenly shake.
1368,6778,2024-01-25 02:10:45.230798,2024-01-28 02:10:45.230798,open,technical,Education others meeting gun indicate national.
1369,2212,2025-06-12 16:44:55.605266,2025-06-14 16:44:55.605266,closed,technical,By middle much choice how light ok.
1370,6508,2023-12-18 14:22:36.445209,2023-12-26 14:22:36.445209,open,billing,Bad less three doctor chance.
1371,5870,2023-07-24 13:35:58.192923,2023-07-26 13:35:58.192923,closed,billing,Check surface she.
1372,8592,2024-07-06 03:28:09.550521,2024-07-13 03:28:09.550521,closed,billing,Capital moment the team.
1373,4867,2024-02-19 13:08:17.334189,2024-02-27 13:08:17.334189,closed,billing,Program issue people food subject good way.
1374,9003,2024-01-25 21:29:22.009341,2024-01-29 21:29:22.009341,open,technical,Force east technology.
1375,9990,2024-06-18 16:44:17.984534,2024-06-25 16:44:17.984534,closed,billing,Bring moment about join good sport practice.
1376,3481,2024-05-15 16:08:47.414615,2024-05-16 16:08:47.414615,closed,technical,Tax strategy perform protect senior some.
1377,4809,2023-11-15 21:37:26.896602,2023-11-21 21:37:26.896602,open,technical,Hit rich bit word score wear be.
1378,4405,2024-04-24 17:52:12.828408,2024-04-28 17:52:12.828408,closed,billing,Happy blood deep cost back beautiful must.
1379,7247,2025-04-27 22:49:37.763265,2025-05-05 22:49:37.763265,closed,billing,If purpose type whole service data.
1380,3750,2024-10-30 16:56:33.248961,2024-11-07 16:56:33.248961,closed,billing,Least last every.
1381,7485,2024-09-22 05:16:44.480415,2024-10-01 05:16:44.480415,closed,billing,Indicate within sometimes imagine seven they argue.
1382,438,2024-12-30 07:02:26.146896,2025-01-09 07:02:26.146896,open,billing,Put score resource nearly who serious.
1383,8851,2025-03-07 19:28:51.618042,2025-03-17 19:28:51.618042,open,technical,Health front carry deal evidence.
1384,2575,2023-11-17 02:22:27.329376,2023-11-25 02:22:27.329376,closed,technical,Security find catch music rock old discover.
1385,4462,2024-07-10 18:35:36.760820,2024-07-20 18:35:36.760820,closed,technical,Key notice clear others issue line.
1386,9680,2024-09-25 12:14:38.834743,2024-10-03 12:14:38.834743,open,billing,Field toward fast important appear.
1387,171,2023-08-03 17:46:35.947625,2023-08-07 17:46:35.947625,open,technical,Door choice hospital leader.
1388,4050,2025-01-25 08:41:51.695947,2025-01-26 08:41:51.695947,open,billing,Kid be approach.
1389,4663,2025-04-24 12:36:19.801861,2025-05-03 12:36:19.801861,closed,billing,Door stock specific often door key.
1390,8816,2023-09-22 00:07:28.388625,2023-10-02 00:07:28.388625,open,billing,Tree sea wait someone boy artist consumer listen.
1391,7354,2025-01-07 19:05:20.484341,2025-01-15 19:05:20.484341,open,billing,Attention point explain oil major result.
1392,5043,2025-06-07 03:23:02.769005,2025-06-10 03:23:02.769005,open,technical,Party kid author assume table build.
1393,1232,2024-05-14 15:20:19.840193,2024-05-24 15:20:19.840193,closed,technical,Whom will suffer about something.
1394,1758,2024-06-04 02:48:49.024599,2024-06-14 02:48:49.024599,closed,billing,Laugh sometimes reduce light especially.
1395,116,2024-12-08 00:06:38.935595,2024-12-17 00:06:38.935595,closed,technical,Economic last difficult size.
1396,3135,2023-11-26 10:37:00.593523,2023-12-04 10:37:00.593523,closed,billing,That short management.
1397,4335,2023-10-10 01:01:45.526605,2023-10-16 01:01:45.526605,open,technical,Perhaps stage himself whatever act.
1398,4983,2024-11-20 06:48:35.738328,2024-11-28 06:48:35.738328,closed,technical,Your black almost safe argue kind suffer.
1399,3903,2023-07-12 01:26:38.636628,2023-07-15 01:26:38.636628,open,technical,Describe center billion camera.
1400,8997,2024-08-05 09:45:41.776722,2024-08-07 09:45:41.776722,closed,billing,Window suddenly hair sense live tend.
1401,6946,2024-04-09 01:50:49.874346,2024-04-19 01:50:49.874346,open,technical,Story gun no live any impact if.
1402,7246,2025-05-12 03:18:27.068863,2025-05-19 03:18:27.068863,closed,billing,About cup outside young reason notice.
1403,6286,2024-07-25 21:25:28.731043,2024-07-29 21:25:28.731043,open,billing,Base later opportunity.
1404,239,2024-08-30 05:07:28.927604,2024-09-06 05:07:28.927604,open,billing,Choice let economic physical.
1405,3755,2024-04-16 21:33:42.009429,2024-04-17 21:33:42.009429,open,technical,Start song cold rich leave society brother.
1406,404,2025-03-12 19:37:27.683773,2025-03-19 19:37:27.683773,closed,billing,Modern price station.
1407,3893,2024-11-11 07:01:43.633484,2024-11-19 07:01:43.633484,open,billing,Community media sure increase thought the evening.
1408,6891,2024-10-26 06:08:21.359632,2024-10-28 06:08:21.359632,open,technical,There stage fall write maintain might different.
1409,2716,2025-01-01 21:18:16.647115,2025-01-05 21:18:16.647115,closed,technical,Fear consider unit time then face light.
1410,5966,2023-11-25 15:35:57.903257,2023-11-29 15:35:57.903257,open,technical,Avoid news skill probably.
1411,2434,2024-01-08 13:07:29.586981,2024-01-15 13:07:29.586981,open,technical,Today modern grow account season north.
1412,5331,2024-04-20 21:24:18.917865,2024-04-22 21:24:18.917865,closed,technical,Number cup day sound during.
1413,6514,2025-03-27 22:55:49.570949,2025-04-03 22:55:49.570949,open,billing,Player likely someone whatever tell question sound.
1414,1768,2024-05-02 16:44:35.448300,2024-05-07 16:44:35.448300,closed,billing,Picture it fund up whom detail.
1415,383,2024-11-16 05:18:58.119915,2024-11-26 05:18:58.119915,closed,technical,Player up manage impact company situation hour.
1416,6416,2024-04-22 00:37:39.844856,2024-04-27 00:37:39.844856,closed,technical,Bar dream debate offer tend instead open space.
1417,6670,2024-07-13 02:51:14.494998,2024-07-21 02:51:14.494998,closed,billing,Any view cup piece score toward blood small.
1418,6630,2024-03-13 16:55:59.464624,2024-03-18 16:55:59.464624,closed,billing,Particular food include nature.
1419,3022,2024-10-06 05:00:26.902320,2024-10-12 05:00:26.902320,closed,billing,Visit three possible air effect.
1420,8932,2025-05-29 02:59:06.496265,2025-06-07 02:59:06.496265,open,technical,Free necessary attention cause.
1421,1729,2024-09-05 20:25:45.306768,2024-09-13 20:25:45.306768,open,technical,Military finally ten city mouth.
1422,5689,2024-02-08 06:04:51.430866,2024-02-15 06:04:51.430866,closed,technical,Sure yeah official authority.
1423,7016,2025-03-26 15:38:17.272301,2025-04-02 15:38:17.272301,closed,billing,May discussion size yard improve into catch task.
1424,8386,2024-12-26 22:53:07.533201,2025-01-01 22:53:07.533201,open,billing,North animal any member seem response matter.
1425,5923,2025-06-08 20:59:00.528383,2025-06-14 20:59:00.528383,open,technical,Prevent glass alone behavior must.
1426,9322,2024-11-18 02:25:43.007036,2024-11-22 02:25:43.007036,closed,billing,Adult rise truth push much describe rich college.
1427,2329,2024-05-17 21:29:40.934753,2024-05-27 21:29:40.934753,closed,technical,Measure executive difficult.
1428,2376,2024-08-12 08:18:02.104817,2024-08-21 08:18:02.104817,open,technical,Any often always exist Mrs.
1429,8986,2024-11-22 13:11:39.825051,2024-11-24 13:11:39.825051,closed,billing,Appear agency attack week affect image few building.
1430,6098,2025-04-10 04:15:29.079969,2025-04-17 04:15:29.079969,closed,billing,Perform enjoy but would reflect research.
1431,370,2023-09-28 12:00:51.394057,2023-10-06 12:00:51.394057,open,billing,New none history claim always child investment.
1432,2321,2023-08-03 02:39:11.313160,2023-08-12 02:39:11.313160,closed,technical,Realize reveal blood nor camera property own.
1433,3215,2024-05-28 22:43:53.549676,2024-05-29 22:43:53.549676,closed,billing,Parent word tonight at.
1434,1459,2025-01-30 19:06:28.343556,2025-02-08 19:06:28.343556,open,billing,Mother experience yard wrong cultural save clear rule.
1435,3224,2025-02-17 14:25:02.081416,2025-02-20 14:25:02.081416,open,billing,Raise understand yeah pay popular.
1436,4407,2025-05-18 00:29:29.763640,2025-05-20 00:29:29.763640,closed,billing,Behavior guy agency significant baby stand arrive.
1437,8620,2024-01-13 06:12:48.339991,2024-01-17 06:12:48.339991,closed,billing,Music husband eye beautiful south argue.
1438,4111,2024-10-07 05:19:54.292700,2024-10-17 05:19:54.292700,closed,billing,Travel middle clearly institution affect top happen.
1439,6110,2025-02-15 11:35:52.458460,2025-02-24 11:35:52.458460,closed,billing,Agent also if when.
1440,1569,2024-03-06 21:21:23.854698,2024-03-16 21:21:23.854698,closed,technical,Democratic nice but everything.
1441,5262,2025-05-04 02:07:51.801011,2025-05-13 02:07:51.801011,open,technical,Somebody lead fly letter method air economy but.
1442,4894,2024-06-23 12:56:18.478026,2024-07-02 12:56:18.478026,open,billing,Would gun TV share bank store check.
1443,2885,2023-09-18 20:51:52.674018,2023-09-22 20:51:52.674018,open,billing,Require ground number surface.
1444,1791,2023-10-16 16:03:28.649972,2023-10-20 16:03:28.649972,closed,technical,Nothing off rich food.
1445,7361,2025-03-04 23:20:38.839848,2025-03-10 23:20:38.839848,open,billing,Commercial result daughter red between understand travel natural.
1446,1047,2023-09-29 01:22:25.812966,2023-10-04 01:22:25.812966,closed,technical,Book officer a.
1447,3343,2023-08-24 00:16:23.166627,2023-09-02 00:16:23.166627,closed,billing,Consumer instead general follow value.
1448,8380,2024-11-24 05:43:17.699705,2024-11-27 05:43:17.699705,open,billing,High provide record without onto nation.
1449,7891,2023-08-03 15:17:38.506023,2023-08-06 15:17:38.506023,open,billing,With enough far party why collection.
1450,7960,2024-07-06 16:26:55.764672,2024-07-08 16:26:55.764672,closed,technical,Move news event home TV company film.
1451,89,2024-10-22 01:29:11.630983,2024-10-24 01:29:11.630983,open,technical,Himself computer security particular throughout ten.
1452,1802,2025-06-08 14:46:31.525840,2025-06-18 14:46:31.525840,closed,billing,Base catch grow short security four share laugh.
1453,919,2024-01-04 18:25:36.991606,2024-01-05 18:25:36.991606,closed,technical,Eye board foot thing fly wind where.
1454,487,2024-03-13 15:01:56.260423,2024-03-22 15:01:56.260423,closed,billing,Nor behind thus table play certainly another study.
1455,6867,2023-08-02 12:52:59.088334,2023-08-10 12:52:59.088334,closed,billing,Music save traditional picture magazine.
1456,2740,2024-12-01 19:43:29.400518,2024-12-06 19:43:29.400518,closed,billing,Bill meet usually past hot.
1457,1205,2024-12-17 10:43:35.674928,2024-12-24 10:43:35.674928,open,technical,Nor organization bring.
1458,4814,2024-03-16 19:50:42.898132,2024-03-24 19:50:42.898132,open,billing,Garden young recent many since half trial.
1459,7204,2024-04-04 12:58:22.339144,2024-04-10 12:58:22.339144,closed,billing,Sort where enter machine.
1460,2889,2023-11-18 18:22:31.482533,2023-11-26 18:22:31.482533,closed,technical,Raise develop sort heart respond everybody.
1461,1316,2025-06-29 18:53:28.655683,2025-07-08 18:53:28.655683,closed,technical,Decide hard moment fight spend.
1462,6100,2024-11-24 11:05:55.640929,2024-11-27 11:05:55.640929,open,billing,Key strong should anything growth couple.
1463,1686,2025-04-24 06:07:57.076994,2025-05-01 06:07:57.076994,closed,technical,Machine we power century item.
1464,2152,2025-06-20 12:52:34.963049,2025-06-25 12:52:34.963049,closed,billing,Lose risk concern report.
1465,2712,2025-02-25 22:33:07.614761,2025-02-27 22:33:07.614761,closed,technical,Moment training society something this policy pick.
1466,1484,2023-11-26 19:56:01.438725,2023-12-06 19:56:01.438725,open,billing,Image hear stay explain history expert.
1467,1710,2024-12-21 11:36:58.603475,2024-12-27 11:36:58.603475,open,technical,Hotel until especially.
1468,5003,2024-06-09 23:05:20.225127,2024-06-12 23:05:20.225127,closed,billing,Kind human he former none sure.
1469,6776,2025-01-23 21:37:46.119382,2025-02-02 21:37:46.119382,open,billing,Speak ahead paper result successful past me.
1470,5117,2024-06-06 10:22:14.334813,2024-06-12 10:22:14.334813,closed,billing,Store seek human likely half care bank class.
1471,9574,2025-03-18 09:18:08.850848,2025-03-26 09:18:08.850848,closed,technical,Measure right born story.
1472,3597,2023-11-30 08:59:30.273047,2023-12-03 08:59:30.273047,open,technical,Before financial customer require.
1473,5528,2023-08-21 10:51:21.435314,2023-08-23 10:51:21.435314,closed,billing,Score walk treatment woman voice investment.
1474,1122,2023-09-04 19:42:17.300315,2023-09-06 19:42:17.300315,open,technical,Exactly fire environmental data wonder bank.
1475,4848,2024-08-15 10:42:17.573666,2024-08-22 10:42:17.573666,closed,billing,Six financial sea after we boy.
1476,7867,2024-02-02 04:36:21.825529,2024-02-03 04:36:21.825529,open,technical,Wish case hotel feeling such.
1477,7134,2024-12-21 07:54:14.756157,2024-12-26 07:54:14.756157,open,technical,According reason so catch should each name.
1478,1916,2024-04-30 03:53:56.307539,2024-05-03 03:53:56.307539,closed,billing,Behavior nor fight reveal available herself its.
1479,5036,2024-08-03 00:59:17.742017,2024-08-13 00:59:17.742017,closed,billing,Enjoy early hit style cost same.
1480,8460,2025-04-25 17:16:30.247668,2025-05-05 17:16:30.247668,open,billing,Environment perhaps wear response.
1481,921,2024-07-22 22:20:19.000448,2024-08-01 22:20:19.000448,closed,billing,Oil standard reduce.
1482,4203,2024-10-08 08:21:00.374375,2024-10-09 08:21:00.374375,closed,billing,Machine loss statement foreign.
1483,917,2023-11-22 04:38:39.530540,2023-11-25 04:38:39.530540,open,billing,Center network matter just probably.
1484,2114,2023-07-04 16:14:19.210541,2023-07-08 16:14:19.210541,closed,technical,Get trouble again firm eye leader hit.
1485,2235,2023-12-01 03:06:14.684280,2023-12-08 03:06:14.684280,open,technical,Media along buy again one.
1486,4142,2024-02-09 19:24:47.263793,2024-02-17 19:24:47.263793,closed,billing,Hour clear identify challenge require will edge.
1487,1908,2024-04-24 09:36:00.225232,2024-04-29 09:36:00.225232,closed,technical,Rule indeed important bill buy make.
1488,9252,2024-08-18 21:20:35.145084,2024-08-23 21:20:35.145084,closed,technical,Window southern both avoid score low.
1489,379,2024-05-04 05:08:30.202313,2024-05-13 05:08:30.202313,open,technical,Radio produce prepare yourself.
1490,3796,2024-07-24 03:24:54.180330,2024-07-26 03:24:54.180330,open,technical,Rock pressure culture.
1491,2013,2025-02-07 23:08:42.872774,2025-02-16 23:08:42.872774,closed,technical,Although eat real machine.
1492,3406,2024-08-17 22:55:44.581576,2024-08-19 22:55:44.581576,closed,billing,Watch hair apply prepare around mind.
1493,3551,2025-05-17 03:34:02.396969,2025-05-18 03:34:02.396969,open,billing,Memory own response run.
1494,7719,2025-05-23 07:51:59.491708,2025-05-25 07:51:59.491708,open,billing,Party itself we seek office decide exactly.
1495,7223,2025-02-22 01:03:22.942581,2025-02-25 01:03:22.942581,open,technical,Age east within their data short factor.
1496,412,2025-04-08 10:28:50.269017,2025-04-15 10:28:50.269017,open,technical,Stand war whole data some ground.
1497,5172,2024-03-17 12:19:45.541103,2024-03-18 12:19:45.541103,open,billing,Someone interest series former speak.
1498,8922,2025-06-19 21:24:35.687268,2025-06-26 21:24:35.687268,closed,billing,Image up scene course.
1499,294,2024-07-29 07:10:25.432527,2024-08-03 07:10:25.432527,open,technical,Push drug Mrs life.
1500,7796,2023-09-06 03:50:38.658514,2023-09-07 03:50:38.658514,open,technical,Represent official never one building read.
1501,7318,2024-06-01 07:04:08.456678,2024-06-08 07:04:08.456678,open,technical,Pay success low chair American involve.
1502,5011,2024-02-05 10:37:49.375707,2024-02-13 10:37:49.375707,open,billing,Certain professional rather deep.
1503,842,2023-10-21 11:45:50.168413,2023-10-30 11:45:50.168413,closed,billing,Here attention high key others behind music us.
1504,5396,2024-04-01 04:53:53.378324,2024-04-02 04:53:53.378324,open,technical,Structure region feel myself.
1505,4602,2023-09-13 18:06:16.408992,2023-09-22 18:06:16.408992,open,technical,Mind child check paper oil.
1506,1668,2025-03-12 00:28:32.744847,2025-03-19 00:28:32.744847,closed,technical,Hundred entire last someone.
1507,1306,2025-04-28 00:43:45.123533,2025-05-07 00:43:45.123533,open,technical,Certainly store add nature morning enter teach whom.
1508,8654,2025-01-04 08:43:00.371392,2025-01-08 08:43:00.371392,open,billing,Example coach network small black by car.
1509,4037,2025-03-04 18:22:29.434966,2025-03-06 18:22:29.434966,open,billing,Those democratic follow feel instead catch.
1510,3287,2025-05-27 21:53:31.737250,2025-06-01 21:53:31.737250,closed,billing,Cold now create drop argue.
1511,4244,2024-05-31 23:12:35.844126,2024-06-01 23:12:35.844126,closed,billing,Large nearly soldier build role.
1512,8192,2024-03-23 21:21:55.046256,2024-03-26 21:21:55.046256,closed,technical,May factor surface north win half.
1513,3075,2024-10-03 13:12:43.363200,2024-10-10 13:12:43.363200,closed,billing,Word whom student rest Mr.
1514,8676,2024-11-01 11:59:49.342536,2024-11-08 11:59:49.342536,closed,technical,Future true protect one.
1515,8203,2024-07-04 03:25:17.005004,2024-07-13 03:25:17.005004,open,technical,National keep across indicate fast.
1516,5765,2023-11-05 11:49:24.940906,2023-11-10 11:49:24.940906,open,billing,Story worry security father item.
1517,1137,2025-06-17 16:19:32.054043,2025-06-19 16:19:32.054043,open,technical,Could yourself serve strategy lead.
1518,2155,2024-04-25 05:14:07.361084,2024-05-05 05:14:07.361084,open,billing,Then better again perhaps film.
1519,5631,2024-10-08 21:03:30.902706,2024-10-17 21:03:30.902706,closed,technical,Professor week help team up push take.
1520,1715,2025-02-25 23:26:31.416201,2025-03-07 23:26:31.416201,open,billing,Could my worker cell determine.
1521,9502,2024-01-23 00:59:05.474357,2024-01-25 00:59:05.474357,open,billing,Rock or question more article.
1522,140,2025-01-30 16:16:57.115302,2025-02-07 16:16:57.115302,closed,billing,Dream study social unit almost.
1523,8764,2025-04-19 14:40:50.410684,2025-04-22 14:40:50.410684,closed,billing,Head girl debate executive leg around.
1524,8458,2025-05-20 19:18:10.084802,2025-05-27 19:18:10.084802,open,billing,Compare capital season later ready word blue.
1525,8013,2024-02-14 01:32:11.943547,2024-02-22 01:32:11.943547,closed,technical,Keep door condition for common.
1526,7241,2024-02-27 00:31:55.669612,2024-03-06 00:31:55.669612,open,billing,Customer day grow fight senior.
1527,5023,2023-07-22 23:18:48.302423,2023-07-24 23:18:48.302423,open,billing,Agree call foreign product.
1528,3195,2023-10-10 15:54:25.912839,2023-10-20 15:54:25.912839,open,technical,Station daughter fund case.
1529,4251,2025-05-04 06:47:30.363003,2025-05-07 06:47:30.363003,closed,billing,Condition painting together test.
1530,1565,2023-10-15 06:33:50.821746,2023-10-21 06:33:50.821746,closed,billing,Direction member learn rate treat think all.
1531,9094,2023-11-07 21:45:19.759270,2023-11-13 21:45:19.759270,closed,technical,Possible there much.
1532,5855,2025-02-14 07:18:05.579749,2025-02-16 07:18:05.579749,closed,billing,Two season head threat fish arm challenge night.
1533,8977,2025-01-06 01:34:26.514338,2025-01-14 01:34:26.514338,closed,billing,Across seven least organization head line particularly.
1534,3222,2024-06-08 02:49:11.440366,2024-06-14 02:49:11.440366,open,technical,Line eight list crime should expert interesting.
1535,502,2025-03-11 17:51:47.771154,2025-03-18 17:51:47.771154,open,technical,Firm region clear over throw child sense.
1536,5806,2023-10-30 12:35:19.564456,2023-11-03 12:35:19.564456,closed,billing,Blood reduce take well three.
1537,542,2024-05-25 17:10:32.378796,2024-06-03 17:10:32.378796,open,technical,Within structure partner best past.
1538,1234,2025-04-18 05:01:14.555890,2025-04-25 05:01:14.555890,open,technical,Design so change capital.
1539,6374,2024-05-27 03:35:04.020327,2024-05-28 03:35:04.020327,closed,billing,Hit fight book go through.
1540,7463,2024-09-28 18:32:47.075330,2024-10-07 18:32:47.075330,open,technical,Or right leave somebody growth month.
1541,2289,2024-11-02 11:37:07.341173,2024-11-05 11:37:07.341173,open,billing,Personal city finally yard.
1542,5470,2024-04-22 13:19:58.044660,2024-04-26 13:19:58.044660,closed,billing,High prevent home action notice.
1543,8186,2024-04-07 16:40:22.970770,2024-04-10 16:40:22.970770,closed,billing,Material cup process bag.
1544,5358,2023-07-17 06:12:09.590129,2023-07-24 06:12:09.590129,open,technical,Assume follow think early popular.
1545,5215,2024-04-06 04:45:37.216325,2024-04-16 04:45:37.216325,closed,billing,Individual guess stage present under movie loss.
1546,9489,2025-04-21 06:18:53.488646,2025-04-23 06:18:53.488646,open,billing,Media research rule baby raise.
1547,9706,2023-10-01 23:48:06.405908,2023-10-08 23:48:06.405908,closed,billing,Notice special commercial administration safe.
1548,4518,2025-02-11 14:56:23.649206,2025-02-19 14:56:23.649206,open,billing,Short stay instead any national although able.
1549,3737,2023-10-24 03:08:42.916805,2023-11-03 03:08:42.916805,closed,billing,Fight minute it week yeah little.
1550,1603,2024-11-02 18:35:57.566885,2024-11-06 18:35:57.566885,open,billing,Story necessary easy agency while organization.
1551,5288,2024-03-08 16:13:57.342748,2024-03-10 16:13:57.342748,open,billing,Series power energy.
1552,2882,2023-08-31 18:58:13.797889,2023-09-05 18:58:13.797889,open,billing,Member mention specific size animal.
1553,3409,2024-05-01 15:16:05.433127,2024-05-09 15:16:05.433127,open,technical,Sit painting lead.
1554,9581,2024-04-21 21:03:58.799954,2024-04-22 21:03:58.799954,open,billing,Past effect majority anything first remember trade.
1555,5952,2025-04-03 15:06:35.215959,2025-04-04 15:06:35.215959,closed,technical,Bar realize suffer hotel.
1556,3667,2025-01-19 10:07:50.219215,2025-01-25 10:07:50.219215,closed,billing,What debate development trouble through understand husband.
1557,8913,2025-01-07 12:38:31.312023,2025-01-10 12:38:31.312023,closed,technical,Under training evening son thus house.
1558,1328,2024-09-21 06:40:47.920808,2024-09-22 06:40:47.920808,closed,technical,Certainly minute society hard body thousand style.
1559,6351,2024-01-08 16:00:16.276016,2024-01-10 16:00:16.276016,open,billing,Attorney fight baby training citizen.
1560,168,2024-10-31 16:49:13.945850,2024-11-06 16:49:13.945850,open,billing,Computer late lot character.
1561,5807,2024-02-21 06:12:01.624143,2024-02-26 06:12:01.624143,open,technical,Show those education material capital itself.
1562,1909,2024-05-15 22:33:05.152667,2024-05-17 22:33:05.152667,closed,billing,Rock be sit ground.
1563,6283,2024-06-15 17:42:20.850986,2024-06-20 17:42:20.850986,closed,technical,Society today wide agency now.
1564,4312,2024-07-17 08:01:20.782645,2024-07-27 08:01:20.782645,open,technical,Prevent part article as our from.
1565,759,2025-03-01 12:48:10.246597,2025-03-07 12:48:10.246597,open,technical,Would admit crime building hot stage.
1566,3919,2023-07-04 18:21:56.891864,2023-07-09 18:21:56.891864,open,billing,Fish energy realize high there easy long.
1567,9601,2023-08-06 10:40:00.985985,2023-08-11 10:40:00.985985,closed,technical,Finally material customer do.
1568,2266,2025-03-30 15:04:29.683911,2025-04-06 15:04:29.683911,open,technical,Benefit strong season available edge.
1569,2367,2025-06-10 22:43:21.001144,2025-06-17 22:43:21.001144,closed,billing,Hope issue husband bit point usually deep.
1570,5042,2025-04-23 22:01:52.531839,2025-04-28 22:01:52.531839,open,billing,Eight necessary imagine race car.
1571,5229,2024-06-17 19:16:31.915569,2024-06-21 19:16:31.915569,closed,technical,Everybody media local service bring manager energy.
1572,3303,2024-07-14 20:05:33.275547,2024-07-19 20:05:33.275547,open,technical,Each station though rich pull campaign.
1573,1137,2024-08-16 04:30:36.645342,2024-08-24 04:30:36.645342,open,billing,Pm clearly north enjoy family moment.
